create table lwt (a int, b int, primary key (a,b));
  OK
-- basic batch: ok
begin batch
    insert into lwt (a, b) values (1, 1) if not exists
apply batch;
  +-----------+---+---+
  | [APPLIED] | A | B |
  +-----------+---+---+
  | true      | 0 | 0 |
  +-----------+---+---+
-- begin unlogged batch + lwt: ok; unlogged is ignored
-- (same in c*)
begin unlogged batch
    insert into lwt (a, b) values (1, 1) if not exists
apply batch;
  +-----------+---+---+
  | [APPLIED] | A | B |
  +-----------+---+---+
  | false     | 1 | 1 |
  +-----------+---+---+
-- begin counter batch + lwt: error
begin counter batch
    insert into lwt (a, b) values (1, 1) if not exists
apply batch;
   status: ERROR
     code: Invalid (0x2200)
  message: Cannot include non-counter statement in a counter batch
-- a batch affecting two partitions: error
begin batch
    insert into lwt (a, b) values (1, 1) if not exists
    insert into lwt (a, b) values (2, 1) if not exists
apply batch;
   status: ERROR
     code: Invalid (0x2200)
  message: BATCH with conditions cannot span multiple partitions
-- a batch with an LWT statement and other statement affecting another
-- partition: error
begin batch
    insert into lwt (a, b) values (1, 1) if not exists
    insert into lwt (a, b) values (2, 1)
apply batch;
   status: ERROR
     code: Invalid (0x2200)
  message: BATCH with conditions cannot span multiple partitions
-- a batch affecting different clustering keys of the same partition: ok
begin batch
    insert into lwt (a, b) values (1, 1) if not exists
    insert into lwt (a, b) values (1, 2) if not exists
apply batch;
  +-----------+---+---+
  | [APPLIED] | A | B |
  +-----------+---+---+
  | false     | 1 | 1 |
  +-----------+---+---+
-- a batch and non-batch statement, on the same partition: ok
begin batch
    insert into lwt (a, b) values (1, 1) if not exists
    insert into lwt (a, b) values (1, 2)
apply batch;
  +-----------+---+---+
  | [APPLIED] | A | B |
  +-----------+---+---+
  | false     | 1 | 1 |
  +-----------+---+---+
-- a batch affecting two tables: error
create table two (a int primary key, b int);
  OK
begin batch
    insert into lwt (a, b) values (1, 1) if not exists
    insert into two (a, b) values (1, 1)
apply batch;
   status: ERROR
     code: Invalid (0x2200)
  message: Batch with conditions cannot span multiple tables
drop table two;
  OK
-- a batch with custom timestamp set: error
begin batch using timestamp 1
    insert into lwt (a, b) values (1, 1) if not exists
apply batch;
   status: ERROR
     code: Invalid (0x2200)
  message: Cannot provide custom timestamp for conditional BATCH
-- a batch with a statement with a custom timestamp: error
begin batch
    insert into lwt (a, b) values (1, 1) if not exists using timestamp 1
apply batch;
   status: ERROR
     code: Invalid (0x2200)
  message: Cannot provide custom timestamp for conditional updates
-- a batch with an LWT statement and another statement with a custom timestamp set: ok
begin batch
    insert into lwt (a, b) values (1, 1) if not exists
    insert into lwt (a, b) values (1, 1) using timestamp 1
apply batch;
  +-----------+---+---+
  | [APPLIED] | A | B |
  +-----------+---+---+
  | false     | 1 | 1 |
  +-----------+---+---+
-- a batch with if condition and counters: error
-- if a table has a counter, all its non-primary key columns
-- must be counters
create table lcounter (a int primary key, c counter);
  OK
begin batch
    update lcounter set c = c + 1 where a = 1 if c = null
apply batch;
   status: ERROR
     code: Invalid (0x2200)
  message: Conditional updates are not supported on counter tables
drop table lcounter;
  OK
drop table lwt;
  OK
create table lwt (a int, b int, c int, primary key (a,b));
  OK
-- a batch with IF condition on primary key: error
begin batch
    update lwt set c = 2 where a = 1 and b = 1 if a > 0
apply batch;
   status: ERROR
     code: Invalid (0x2200)
  message: PRIMARY KEY column 'a' cannot have IF conditions
begin batch
    update lwt set c = 2 where a = 1 and b = 1 if b > 0
apply batch;
   status: ERROR
     code: Invalid (0x2200)
  message: PRIMARY KEY column 'b' cannot have IF conditions
begin batch
    update lwt set c = 2 where a = 1 if c = null
apply batch;
   status: ERROR
     code: Invalid (0x2200)
  message: Missing mandatory PRIMARY KEY part b
-- a batch with a statement that has IN prediacte and IF condition: error
begin batch
    update lwt set c = 2 where a = 1 and b in (1, 2) if c = null
apply batch;
   status: ERROR
     code: Invalid (0x2200)
  message: IN on the clustering key columns is not supported with conditional updates
-- a batch with a statement that has IN prediacte and *another* statement
-- with IF condition: OK. This is an error in C* but I see no reason
-- why it should be an error in Scylla.
delete from lwt where a = 1;
  OK
begin batch
    update lwt set c = 2 where a = 1 and b = 1 if c = null
    update lwt set c = 2 where a = 1 and b in (1, 2)
apply batch;
  +-----------+---+---+---+
  | [APPLIED] | A | B | C |
  +-----------+---+---+---+
  | true      | 0 | 0 | 0 |
  +-----------+---+---+---+
select a, b, c from lwt where a =  1 and b in (1, 2);
  +---+---+---+
  | A | B | C |
  +---+---+---+
  | 1 | 1 | 2 |
  | 1 | 2 | 2 |
  +---+---+---+
drop table lwt;
  OK
--
-- BATCH LWT with multiple statements on LIST data type,
-- append/discard operations on the type: all append/discard
-- operations from all stsatemetns of the batch are applied
--
create table lwt (a int, b int, c list<text>, d list<text> static, primary key (a, b));
  OK
begin batch
    insert into lwt (a, b, c, d ) values (1, 1, ['1'], ['1']) if not exists
    insert into lwt (a, b, c, d ) values (1, 2, ['2'], ['2']) if not exists
apply batch;
  +-----------+---+---+----+----+
  | [APPLIED] | A | B | D  | C  |
  +-----------+---+---+----+----+
  | true      | 0 | 0 | [] | [] |
  +-----------+---+---+----+----+
select b, c, d from lwt where a = 1;
  +---+-----+-------+
  | B |  C  |   D   |
  +---+-----+-------+
  | 1 | [1] | [1 2] |
  | 2 | [2] | [1 2] |
  +---+-----+-------+
begin batch
    update lwt set c = c + ['3'], d = d + ['3'] where a = 1 and b = 1 if exists
    update lwt set c = c + ['4'], d = d + ['4'] where a = 1 and b = 2
apply batch;
  +-----------+---+---+-------+-----+
  | [APPLIED] | A | B |   D   |  C  |
  +-----------+---+---+-------+-----+
  | true      | 1 | 1 | [1 2] | [1] |
  +-----------+---+---+-------+-----+
select b, c, d from lwt where a = 1;
  +---+-------+-----------+
  | B |   C   |     D     |
  +---+-------+-----------+
  | 1 | [1 3] | [1 2 3 4] |
  | 2 | [2 4] | [1 2 3 4] |
  +---+-------+-----------+
begin batch
    update lwt set c = c + ['5'], d = d + ['5'] where a = 1 and b = 1 if c[0] = '1' and c[1] = '3'
    update lwt set c = c + ['6'], d = d + ['6'] where a = 1 and b = 2
apply batch;
  +-----------+---+---+-------+
  | [APPLIED] | A | B |   C   |
  +-----------+---+---+-------+
  | true      | 1 | 1 | [1 3] |
  +-----------+---+---+-------+
select b, c, d from lwt where a = 1;
  +---+---------+---------------+
  | B |    C    |       D       |
  +---+---------+---------------+
  | 1 | [1 3 5] | [1 2 3 4 5 6] |
  | 2 | [2 4 6] | [1 2 3 4 5 6] |
  +---+---------+---------------+
-- multiple conditions:
-- two simple conditions, effects of all statements are applied atomically
-- or not applied at all: ok
begin batch
    update lwt set c = c + ['7'], d = d + ['7'] where a = 1 and b = 1 if c[0] = '1' and c[1] = '2'
    update lwt set c = c + ['8'], d = d + ['8'] where a = 1 and b = 2 if c[3] = '3' and c[4] = '4'
apply batch;
  +-----------+---+---+---------+
  | [APPLIED] | A | B |    C    |
  +-----------+---+---+---------+
  | false     | 1 | 1 | [1 3 5] |
  | false     | 1 | 2 | [2 4 6] |
  +-----------+---+---+---------+
select b, c, d from lwt where a = 1;
  +---+---------+---------------+
  | B |    C    |       D       |
  +---+---------+---------------+
  | 1 | [1 3 5] | [1 2 3 4 5 6] |
  | 2 | [2 4 6] | [1 2 3 4 5 6] |
  +---+---------+---------------+
begin batch
    update lwt set c = c + ['7'], d = d + ['7'] where a = 1 and b = 1 if c[0] = '1' and c[1] = '3'
    update lwt set c = c + ['8'], d = d + ['8'] where a = 1 and b = 2 if c[1] = '4' and c[2] = '6'
apply batch;
  +-----------+---+---+---------+
  | [APPLIED] | A | B |    C    |
  +-----------+---+---+---------+
  | true      | 1 | 1 | [1 3 5] |
  | true      | 1 | 2 | [2 4 6] |
  +-----------+---+---+---------+
select b, c, d from lwt where a = 1;
  +---+-----------+-------------------+
  | B |     C     |         D         |
  +---+-----------+-------------------+
  | 1 | [1 3 5 7] | [1 2 3 4 5 6 7 8] |
  | 2 | [2 4 6 8] | [1 2 3 4 5 6 7 8] |
  +---+-----------+-------------------+
drop table lwt;
  OK

-- batch + lwt + range UPDATE of multiple rows, clustering key is not fully restricted: ok
-- batch + lwt + range DELETE of multiple rows, clustering key is not fully restricted: ok
-- usually within the same partition key
create table lwt (a int, b int, c int, d int, primary key (a, b, c));
  OK
insert into lwt (a, b, c, d) values (1,1,1,1);
  OK
insert into lwt (a, b, c, d) values (1,1,2,0);
  OK
insert into lwt (a, b, c, d) values (1,1,3,1);
  OK
insert into lwt (a, b, c, d) values (1,2,1,1);
  OK
insert into lwt (a, b, c, d) values (1,2,2,0);
  OK
insert into lwt (a, b, c, d) values (1,2,3,1);
  OK
-- update
begin batch
    update lwt set d = 7 where a = 1 and b = 1 and c = 1 if exists
    update lwt set d = 7 where a = 1 and b in  (1,2) and c in (1,2,3)
apply batch;
  +-----------+---+---+---+---+
  | [APPLIED] | A | B | C | D |
  +-----------+---+---+---+---+
  | true      | 1 | 1 | 1 | 1 |
  +-----------+---+---+---+---+
select a, b, c, d from lwt where a = 1;
  +---+---+---+---+
  | A | B | C | D |
  +---+---+---+---+
  | 1 | 1 | 1 | 7 |
  | 1 | 1 | 2 | 7 |
  | 1 | 1 | 3 | 7 |
  | 1 | 2 | 1 | 7 |
  | 1 | 2 | 2 | 7 |
  | 1 | 2 | 3 | 7 |
  +---+---+---+---+
-- delete
begin batch
    delete from lwt where a = 1 and b = 1 if exists
    delete from lwt where a = 1 and b = 2 if exists
apply batch;
   status: ERROR
     code: Invalid (0x2200)
  message: DELETE statements must restrict all PRIMARY KEY columns with equality relations 
-- select a, b, c, d from lwt where a = 1;
drop table lwt;
  OK

-- Rows fetched for statements that require read but has no conditions
-- must not be included into the result set.
create table lwt(p int, c int, i int, l list<int>, primary key(p, c));
  OK
insert into lwt(p, c, i, l) values(1, 1, 1, [1, 2]);
  OK
insert into lwt(p, c, i, l) values(1, 2, 2, [1, 2, 3, 4]);
  OK
-- doesn't apply
begin batch
update lwt set i = 3 where p = 1 and c = 1 if i = 2
update lwt set l = l - [1] where p = 1 and c = 2
apply batch;
  +-----------+---+---+---+
  | [APPLIED] | P | C | I |
  +-----------+---+---+---+
  | false     | 1 | 1 | 1 |
  +-----------+---+---+---+
-- applies
begin batch
update lwt set i = 2 where p = 1 and c = 1 if i = 1
update lwt set l = l - [2] where p = 1 and c = 2
apply batch;
  +-----------+---+---+---+
  | [APPLIED] | P | C | I |
  +-----------+---+---+---+
  | true      | 1 | 1 | 1 |
  +-----------+---+---+---+
-- doesn't apply
begin batch
delete l from lwt where p = 1 and c = 3 if exists
update lwt set l = l - [3] where p = 1 and c = 2
apply batch;
  +-----------+---+---+---+----+
  | [APPLIED] | P | C | I | L  |
  +-----------+---+---+---+----+
  | false     | 0 | 0 | 0 | [] |
  +-----------+---+---+---+----+
-- applies
begin batch
delete l from lwt where p = 1 and c = 1 if exists
update lwt set l = l - [4] where p = 1 and c = 2
apply batch;
  +-----------+---+---+---+-------+
  | [APPLIED] | P | C | I |   L   |
  +-----------+---+---+---+-------+
  | true      | 1 | 1 | 2 | [1 2] |
  +-----------+---+---+---+-------+
select * from lwt;
  +---+---+---+-------+
  | P | C | I |   L   |
  +---+---+---+-------+
  | 1 | 1 | 2 | []    |
  | 1 | 2 | 2 | [1 3] |
  +---+---+---+-------+
drop table lwt;
  OK

-- Suppose there's a batch with two statements, one of which has clustering
-- column restrictions that select no row, another has static conditions.
-- In this case we must fetch the static row (provided it exists, of course)
-- to check the static column conditions.
create table lwt (p int, c int, s int static, primary key (p, c));
  OK
insert into lwt(p, s) values(1, 1);
  OK
begin batch
insert into lwt(p, c) values(1, 1) if not exists
update lwt set s = 2 where p = 1 if s = 1
apply batch;
  +-----------+---+---+---+
  | [APPLIED] | P | C | S |
  +-----------+---+---+---+
  | true      | 1 | 0 | 1 |
  +-----------+---+---+---+
select * from lwt;
  +---+---+---+
  | P | C | S |
  +---+---+---+
  | 1 | 1 | 2 |
  +---+---+---+
drop table lwt;
  OK
--
--
-- condtitions on different list columns and different rows of the same
-- partition, these columns are retreived fine and the appropriate row
-- is found when checking the conds
--
-- correct read command: statement 1 condition is on column a and list update
-- is on column b, while statement b condition is on column c and list
-- update is on column d
-- a composite read command is built and both rows are retreieved,
-- conditions are executed correctly and mutations are applied accordingly
