--
-- basic: ensure the grammar works
--
create table lwt (a int primary key, b int);
  OK
-- insert if not exists
insert into lwt (a, b) values (1, 1) if not exists;
  +-----------+---+---+
  | [APPLIED] | A | B |
  +-----------+---+---+
  | true      | 0 | 0 |
  +-----------+---+---+
select * from lwt allow filtering;
  +---+---+
  | A | B |
  +---+---+
  | 1 | 1 |
  +---+---+
-- delete if exists
delete from lwt where a=1 if exists;
  +-----------+---+---+
  | [APPLIED] | A | B |
  +-----------+---+---+
  | true      | 1 | 1 |
  +-----------+---+---+
select * from lwt allow filtering;
  OK
-- update with condition
update lwt set b = 2 where a=1 if b = 1;
  +-----------+---+
  | [APPLIED] | B |
  +-----------+---+
  | false     | 0 |
  +-----------+---+
select * from lwt allow filtering;
  OK
-- update if exists
update lwt set b = 2 where a = 1 if exists;
  +-----------+---+---+
  | [APPLIED] | A | B |
  +-----------+---+---+
  | false     | 0 | 0 |
  +-----------+---+---+
select * from lwt allow filtering;
  OK
-- update if exists with a scan: proper error message
update lwt set b = 2 where b = 1 if exists;
   status: ERROR
     code: Invalid (0x2200)
  message: Cannot execute this query as it might involve data filtering and thus may have u
select * from lwt allow filtering;
  OK
-- incorrect syntax: update if *not* exists
update lwt set b=3 where a=2 if not exists;
   status: ERROR
     code: Syntax error (0x2000)
  message: line 1:32 no viable alternative at input 'not'
-- incorrect syntax: delete if *not* exists
delete from lwt where a=2 if not exists;
   status: ERROR
     code: Syntax error (0x2000)
  message: line 1:29 no viable alternative at input 'not'
--
-- timestamp: using timestamp clause is not allowed
--
-- check that using timestamp without LWT clause works
insert into lwt (a, b) values (1, 1) using timestamp 1;
  OK
-- with LWT, it's not allowed
insert into lwt (a, b) values (1, 1) if not exists using timestamp 1;
   status: ERROR
     code: Invalid (0x2200)
  message: Cannot provide custom timestamp for conditional updates
--
--
-- update if not exists is not allowed (grammar error), it doesn't make sense
update lwt set b = 2 where a = 1 if not exists;
   status: ERROR
     code: Syntax error (0x2000)
  message: line 1:36 no viable alternative at input 'not'
-- update with multiple partitions can not have conditions
-- Cassandra output: code=2200 [Invalid query] message="IN on the partition
-- key is not supported with conditional updates"
update lwt set b = 2 where a in (1, 2) if b = 1;
   status: ERROR
     code: Invalid (0x2200)
  message: IN on the partition key is not supported with conditional updates

drop table lwt;
  OK
--
-- basic: ends
--
--
-- clustering: tests related to lwt and clustering keys
--
-- create a table with a partitioning key and a clustering key
create table lwt (a int, b int, c int, primary key (a,b));
  OK
-- update with multiple clustering keys can not have conditions
-- Cassandra output: code=2200 [Invalid query] message="IN on the clustering
-- key is not supported with conditional updates"
update lwt set c = 2 where a = 1 and b in (2,3)  if c = 1;
   status: ERROR
     code: Invalid (0x2200)
  message: IN on the clustering key columns is not supported with conditional updates
-- update with a clustering key - should work
update lwt set c = 2 where a = 1 and b = 2  if c = 1;
  +-----------+---+
  | [APPLIED] | C |
  +-----------+---+
  | false     | 0 |
  +-----------+---+
-- update with a single clustering key inside IN predicate
-- correctly identified as a single-key update
update lwt set c = 2 where a = 1 and b in (2) if c = 1;
  +-----------+---+
  | [APPLIED] | C |
  +-----------+---+
  | false     | 0 |
  +-----------+---+
-- unrestricted conditional update,
-- Casssandra: code=2200 [Invalid query]
-- message="Some clustering keys are missing: b"
update lwt set c=3 where a=1 if c=2;
   status: ERROR
     code: Invalid (0x2200)
  message: Missing mandatory PRIMARY KEY part b
--  comparing columns
update lwt set c=3 where a=1 if c=a;
   status: ERROR
     code: Syntax error (0x2000)
  message: line 1:35 no viable alternative at input ';'
-- cleanup
drop table lwt;
  OK
--
-- clustering: ends
--
-- limitations: check grammar/feature limitations of LWT
--
create table lwt (a int, b frozen<map<int, int>>, c int, primary key (a, b));
  OK
insert into lwt (a, b, c) values (1, {1:1, 2:2}, 3);
  OK
-- Strictcly speaking this is not an LWT check, but we need to ensure that
-- LWT restrictions are a superposition of modification statement
-- restrictions
update lwt set c=3 where a=1 and b contains 1 if c=1;
   status: ERROR
     code: Invalid (0x2200)
  message: Cannot restrict clustering columns by a CONTAINS relation without a secondary in
update lwt set c=3 where a=1 if c like 'asd';
   status: ERROR
     code: Invalid (0x2200)
  message: Unsupported operator type LIKE in a condition 

drop table lwt;
  OK

-- conditional updates and counters: not supported
create table lwt (a int primary key, b counter);
  OK
update lwt set  b = b+1 where a = 1;
  OK
update lwt set  b = b+1 where a = 1 if exists;
   status: ERROR
     code: Invalid (0x2200)
  message: Conditional updates are not supported on counter tables
insert into lwt (a, b) values (1,1) if not exists;
   status: ERROR
     code: Invalid (0x2200)
  message: INSERT statement are not allowed on counter tables, use UPDATE instead
delete from lwt where a=1 if exists;
   status: ERROR
     code: Invalid (0x2200)
  message: Conditional updates are not supported on counter tables
delete from lwt where a=1 if b=2;
   status: ERROR
     code: Invalid (0x2200)
  message: Conditional updates are not supported on counter tables
drop table lwt;
  OK
--
-- limitations: ends
--
---
-- if_exists: check if exists/if not exists works
---
create table lwt (a int primary key, b int);
  OK
-- insert if not exists
insert into lwt (a, b) values (1, 1) if not exists;
  +-----------+---+---+
  | [APPLIED] | A | B |
  +-----------+---+---+
  | true      | 0 | 0 |
  +-----------+---+---+
select * from lwt allow filtering;
  +---+---+
  | A | B |
  +---+---+
  | 1 | 1 |
  +---+---+
-- should not update
insert into lwt (a, b) values (1, 2) if not exists;
  +-----------+---+---+
  | [APPLIED] | A | B |
  +-----------+---+---+
  | false     | 1 | 1 |
  +-----------+---+---+
select * from lwt allow filtering;
  +---+---+
  | A | B |
  +---+---+
  | 1 | 1 |
  +---+---+
-- should update
insert into lwt (a, b) values (2, 2) if not exists;
  +-----------+---+---+
  | [APPLIED] | A | B |
  +-----------+---+---+
  | true      | 0 | 0 |
  +-----------+---+---+
select * from lwt allow filtering;
  +---+---+
  | A | B |
  +---+---+
  | 1 | 1 |
  | 2 | 2 |
  +---+---+
-- should delete
delete from lwt where a=2 if exists;
  +-----------+---+---+
  | [APPLIED] | A | B |
  +-----------+---+---+
  | true      | 2 | 2 |
  +-----------+---+---+
select * from lwt allow filtering;
  +---+---+
  | A | B |
  +---+---+
  | 1 | 1 |
  +---+---+
-- should not update
update lwt set b=3 where a=2 if exists;
  +-----------+---+---+
  | [APPLIED] | A | B |
  +-----------+---+---+
  | false     | 0 | 0 |
  +-----------+---+---+
select * from lwt allow filtering;
  +---+---+
  | A | B |
  +---+---+
  | 1 | 1 |
  +---+---+
-- should update
update lwt set b=3 where a=1 if exists;
  +-----------+---+---+
  | [APPLIED] | A | B |
  +-----------+---+---+
  | true      | 1 | 1 |
  +-----------+---+---+
select * from lwt allow filtering;
  +---+---+
  | A | B |
  +---+---+
  | 1 | 3 |
  +---+---+
drop table lwt;
  OK
--
-- if_exists: ends end of check for if-exists/if-not-exists
--
-- conditional updates and static columns
-- see also https://issues.apache.org/jira/browse/CASSANDRA-10532
create table lwt (id bigint, uuid uuid, stc text static, value text, primary key(id, uuid));
  OK
delete stc FROM lwt WHERE id=1 IF stc='key';
  +-----------+-----+
  | [APPLIED] | STC |
  +-----------+-----+
  | false     |     |
  +-----------+-----+
drop table lwt;
  OK

create table lwt (p int, c int, s int static, v int, primary key(p, c));
  OK
insert into lwt(p, c, v) values(1, 1, 1);
  OK
select * from lwt;
  +---+---+---+---+
  | P | C | S | V |
  +---+---+---+---+
  | 1 | 1 | 0 | 1 |
  +---+---+---+---+
-- must fail: regular row conditions do not match
insert into lwt(p, c, v) values(1, 1, 10) if not exists;
  +-----------+---+---+---+---+
  | [APPLIED] | P | C | S | V |
  +-----------+---+---+---+---+
  | false     | 1 | 1 | 0 | 1 |
  +-----------+---+---+---+---+
insert into lwt(p, c, s) values(1, 1, 10) if not exists;
  +-----------+---+---+---+---+
  | [APPLIED] | P | C | S | V |
  +-----------+---+---+---+---+
  | false     | 1 | 1 | 0 | 1 |
  +-----------+---+---+---+---+
update lwt set v=10 where p=1 and c=1 if v=2;
  +-----------+---+
  | [APPLIED] | V |
  +-----------+---+
  | false     | 1 |
  +-----------+---+
delete from lwt where p=1 and c=1 if v=2;
  +-----------+---+
  | [APPLIED] | V |
  +-----------+---+
  | false     | 1 |
  +-----------+---+
select * from lwt;
  +---+---+---+---+
  | P | C | S | V |
  +---+---+---+---+
  | 1 | 1 | 0 | 1 |
  +---+---+---+---+
-- must succeed: regular row conditions match
insert into lwt(p, c, v) values(1, 2, 2) if not exists;
  +-----------+---+---+---+---+
  | [APPLIED] | P | C | S | V |
  +-----------+---+---+---+---+
  | true      | 0 | 0 | 0 | 0 |
  +-----------+---+---+---+---+
update lwt set v=10 where p=1 and c=1 if v=1;
  +-----------+---+
  | [APPLIED] | V |
  +-----------+---+
  | true      | 1 |
  +-----------+---+
update lwt set v=20 where p=1 and c=2 if exists;
  +-----------+---+---+---+---+
  | [APPLIED] | P | C | S | V |
  +-----------+---+---+---+---+
  | true      | 1 | 2 | 0 | 2 |
  +-----------+---+---+---+---+
select * from lwt;
  +---+---+---+----+
  | P | C | S | V  |
  +---+---+---+----+
  | 1 | 1 | 0 | 10 |
  | 1 | 2 | 0 | 20 |
  +---+---+---+----+
-- must fail: there is no static row in the partition
update lwt set s=2 where p=1 if exists;
  +-----------+---+---+---+----+
  | [APPLIED] | P | C | S | V  |
  +-----------+---+---+---+----+
  | false     | 1 | 1 | 0 | 10 |
  +-----------+---+---+---+----+
update lwt set s=2 where p=1 if s=1;
  +-----------+---+
  | [APPLIED] | S |
  +-----------+---+
  | false     | 0 |
  +-----------+---+
update lwt set v=2 where p=1 and c=1 if s=1;
  +-----------+---+
  | [APPLIED] | S |
  +-----------+---+
  | false     | 0 |
  +-----------+---+
delete s from lwt where p=1 if exists;
  +-----------+---+---+---+----+
  | [APPLIED] | P | C | S | V  |
  +-----------+---+---+---+----+
  | false     | 1 | 1 | 0 | 10 |
  +-----------+---+---+---+----+
delete s from lwt where p=1 if s=1;
  +-----------+---+
  | [APPLIED] | S |
  +-----------+---+
  | false     | 0 |
  +-----------+---+
delete v from lwt where p=1 and c=1 if s=1;
  +-----------+---+
  | [APPLIED] | S |
  +-----------+---+
  | false     | 0 |
  +-----------+---+
delete s from lwt where p=1 and c=1 if s=1 and v=10;
  +-----------+---+----+
  | [APPLIED] | S | V  |
  +-----------+---+----+
  | false     | 0 | 10 |
  +-----------+---+----+
delete v from lwt where p=1 and c=1 if s=1 and v=10;
  +-----------+---+----+
  | [APPLIED] | S | V  |
  +-----------+---+----+
  | false     | 0 | 10 |
  +-----------+---+----+
delete from lwt where p=1 and c=1 if s=1;
  +-----------+---+
  | [APPLIED] | S |
  +-----------+---+
  | false     | 0 |
  +-----------+---+
delete from lwt where p=1 and c=1 if s=1 and v=10;
  +-----------+---+----+
  | [APPLIED] | S | V  |
  +-----------+---+----+
  | false     | 0 | 10 |
  +-----------+---+----+
select * from lwt;
  +---+---+---+----+
  | P | C | S | V  |
  +---+---+---+----+
  | 1 | 1 | 0 | 10 |
  | 1 | 2 | 0 | 20 |
  +---+---+---+----+
-- must succeed: there is no static row in the partition (even though there are regular rows)
insert into lwt(p, s) values(1, 1) if not exists;
  +-----------+---+---+---+----+
  | [APPLIED] | P | C | S | V  |
  +-----------+---+---+---+----+
  | true      | 1 | 1 | 0 | 10 |
  +-----------+---+---+---+----+
select * from lwt;
  +---+---+---+----+
  | P | C | S | V  |
  +---+---+---+----+
  | 1 | 1 | 1 | 10 |
  | 1 | 2 | 1 | 20 |
  +---+---+---+----+
-- must fail: static row conditions do not match
insert into lwt(p, s) values(1, 2) if not exists;
  +-----------+---+---+---+----+
  | [APPLIED] | P | C | S | V  |
  +-----------+---+---+---+----+
  | false     | 1 | 1 | 1 | 10 |
  +-----------+---+---+---+----+
update lwt set s=3 where p=1 if s=2;
  +-----------+---+
  | [APPLIED] | S |
  +-----------+---+
  | false     | 1 |
  +-----------+---+
update lwt set v=3 where p=1 and c=1 if s=2;
  +-----------+---+
  | [APPLIED] | S |
  +-----------+---+
  | false     | 1 |
  +-----------+---+
delete s from lwt where p=1 if s=2;
  +-----------+---+
  | [APPLIED] | S |
  +-----------+---+
  | false     | 1 |
  +-----------+---+
delete v from lwt where p=1 and c=1 if s=2;
  +-----------+---+
  | [APPLIED] | S |
  +-----------+---+
  | false     | 1 |
  +-----------+---+
delete s from lwt where p=1 and c=1 if s=2 and v=10;
  +-----------+---+----+
  | [APPLIED] | S | V  |
  +-----------+---+----+
  | false     | 1 | 10 |
  +-----------+---+----+
delete v from lwt where p=1 and c=1 if s=2 and v=10;
  +-----------+---+----+
  | [APPLIED] | S | V  |
  +-----------+---+----+
  | false     | 1 | 10 |
  +-----------+---+----+
delete from lwt where p=1 and c=1 if s=2;
  +-----------+---+
  | [APPLIED] | S |
  +-----------+---+
  | false     | 1 |
  +-----------+---+
delete from lwt where p=1 and c=1 if s=2 and v=10;
  +-----------+---+----+
  | [APPLIED] | S | V  |
  +-----------+---+----+
  | false     | 1 | 10 |
  +-----------+---+----+
-- must succeed: regular row conditions match
delete from lwt where p=1 and c=1 if exists;
  +-----------+---+---+---+----+
  | [APPLIED] | P | C | S | V  |
  +-----------+---+---+---+----+
  | true      | 1 | 1 | 1 | 10 |
  +-----------+---+---+---+----+
delete from lwt where p=1 and c=2 if v=20;
  +-----------+----+
  | [APPLIED] | V  |
  +-----------+----+
  | true      | 20 |
  +-----------+----+
select * from lwt;
  +---+---+---+---+
  | P | C | S | V |
  +---+---+---+---+
  | 1 | 0 | 1 | 0 |
  +---+---+---+---+
-- must succeed: there is no regular rows in the partition (even though there is a static row)
insert into lwt(p, c, v) values(1, 1, 1) if not exists;
  +-----------+---+---+---+---+
  | [APPLIED] | P | C | S | V |
  +-----------+---+---+---+---+
  | true      | 0 | 0 | 0 | 0 |
  +-----------+---+---+---+---+
select * from lwt;
  +---+---+---+---+
  | P | C | S | V |
  +---+---+---+---+
  | 1 | 1 | 1 | 1 |
  +---+---+---+---+
delete from lwt where p=1 and c=1;
  OK
select * from lwt;
  +---+---+---+---+
  | P | C | S | V |
  +---+---+---+---+
  | 1 | 0 | 1 | 0 |
  +---+---+---+---+
-- must fail: there is no regular rows in the partition
update lwt set v=10 where p=1 and c=1 if exists;
  +-----------+---+---+---+---+
  | [APPLIED] | P | C | S | V |
  +-----------+---+---+---+---+
  | false     | 0 | 0 | 0 | 0 |
  +-----------+---+---+---+---+
update lwt set v=10 where p=1 and c=1 if s=1 and v=1;
  +-----------+---+---+
  | [APPLIED] | S | V |
  +-----------+---+---+
  | false     | 1 | 0 |
  +-----------+---+---+
update lwt set s=10 where p=1 and c=1 if s=1 and v=1;
  +-----------+---+---+
  | [APPLIED] | S | V |
  +-----------+---+---+
  | false     | 1 | 0 |
  +-----------+---+---+
delete s from lwt where p=1 and c=1 if s=1 and v=1;
  +-----------+---+---+
  | [APPLIED] | S | V |
  +-----------+---+---+
  | false     | 1 | 0 |
  +-----------+---+---+
delete v from lwt where p=1 and c=1 if s=1 and v=1;
  +-----------+---+---+
  | [APPLIED] | S | V |
  +-----------+---+---+
  | false     | 1 | 0 |
  +-----------+---+---+
delete from lwt where p=1 and c=1 if s=1 and v=1;
  +-----------+---+---+
  | [APPLIED] | S | V |
  +-----------+---+---+
  | false     | 1 | 0 |
  +-----------+---+---+
select * from lwt;
  +---+---+---+---+
  | P | C | S | V |
  +---+---+---+---+
  | 1 | 0 | 1 | 0 |
  +---+---+---+---+
-- must succeed: the condition applies only to the static row
delete from lwt where p=1 and c=1 if s=1;
  +-----------+---+
  | [APPLIED] | S |
  +-----------+---+
  | true      | 1 |
  +-----------+---+
delete v from lwt where p=1 and c=1 if s=1;
  +-----------+---+
  | [APPLIED] | S |
  +-----------+---+
  | true      | 1 |
  +-----------+---+
update lwt set v=10 where p=1 and c=1 if s=1;
  +-----------+---+
  | [APPLIED] | S |
  +-----------+---+
  | true      | 1 |
  +-----------+---+
update lwt set s=10 where p=1 if s=1;
  +-----------+---+
  | [APPLIED] | S |
  +-----------+---+
  | true      | 1 |
  +-----------+---+
select * from lwt;
  +---+---+----+----+
  | P | C | S  | V  |
  +---+---+----+----+
  | 1 | 1 | 10 | 10 |
  +---+---+----+----+
insert into lwt(p, c, s, v) values(2, 2, 20, 20);
  OK
insert into lwt(p, s) values(3, 30);
  OK
insert into lwt(p, s) values(4, 40);
  OK
select * from lwt;
  +---+---+----+----+
  | P | C | S  | V  |
  +---+---+----+----+
  | 1 | 1 | 10 | 10 |
  | 2 | 2 | 20 | 20 |
  | 4 | 0 | 40 |  0 |
  | 3 | 0 | 30 |  0 |
  +---+---+----+----+
-- must succeed: static row conditions match
delete s from lwt where p=1 if exists;
  +-----------+---+---+----+----+
  | [APPLIED] | P | C | S  | V  |
  +-----------+---+---+----+----+
  | true      | 1 | 1 | 10 | 10 |
  +-----------+---+---+----+----+
delete s from lwt where p=2 if s=20;
  +-----------+----+
  | [APPLIED] | S  |
  +-----------+----+
  | true      | 20 |
  +-----------+----+
delete s from lwt where p=3 if exists;
  +-----------+---+---+----+---+
  | [APPLIED] | P | C | S  | V |
  +-----------+---+---+----+---+
  | true      | 3 | 0 | 30 | 0 |
  +-----------+---+---+----+---+
delete s from lwt where p=4 if s=40;
  +-----------+----+
  | [APPLIED] | S  |
  +-----------+----+
  | true      | 40 |
  +-----------+----+
select * from lwt;
  +---+---+---+----+
  | P | C | S | V  |
  +---+---+---+----+
  | 1 | 1 | 0 | 10 |
  | 2 | 2 | 0 | 20 |
  +---+---+---+----+
insert into lwt(p, c, v) values(1, 1, 1);
  OK
insert into lwt(p, c, v, s) values(1, 2, 2, 1);
  OK
insert into lwt(p, c, v) values(2, 1, 1);
  OK
insert into lwt(p, c, v) values(2, 2, 2);
  OK
insert into lwt(p, c, v, s) values(2, 3, 3, 1);
  OK
-- must succeed: both static and regular row conditions match
delete v from lwt where p=1 and c=1 if v=1 and s=1;
  +-----------+---+---+
  | [APPLIED] | S | V |
  +-----------+---+---+
  | true      | 1 | 1 |
  +-----------+---+---+
delete s from lwt where p=1 and c=2 if v=2 and s=1;
  +-----------+---+---+
  | [APPLIED] | S | V |
  +-----------+---+---+
  | true      | 1 | 2 |
  +-----------+---+---+
delete from lwt where p=2 and c=3 if v=3 and s=1;
  +-----------+---+---+
  | [APPLIED] | S | V |
  +-----------+---+---+
  | true      | 1 | 3 |
  +-----------+---+---+
update lwt set v=2 where p=2 and c=1 if v=1 and s=1;
  +-----------+---+---+
  | [APPLIED] | S | V |
  +-----------+---+---+
  | true      | 1 | 1 |
  +-----------+---+---+
update lwt set s=2 where p=2 and c=2 if v=2 and s=1;
  +-----------+---+---+
  | [APPLIED] | S | V |
  +-----------+---+---+
  | true      | 1 | 2 |
  +-----------+---+---+
select * from lwt;
  +---+---+---+---+
  | P | C | S | V |
  +---+---+---+---+
  | 1 | 1 | 0 | 0 |
  | 1 | 2 | 0 | 2 |
  | 2 | 1 | 2 | 2 |
  | 2 | 2 | 2 | 2 |
  +---+---+---+---+
-- sanity checks
update lwt set v=1 where p=1 if exists;
   status: ERROR
     code: Invalid (0x2200)
  message: Missing mandatory PRIMARY KEY part c
update lwt set v=1 where p=1 if s=1;
   status: ERROR
     code: Invalid (0x2200)
  message: Missing mandatory PRIMARY KEY part c
update lwt set v=1 where p=1 if v=1;
   status: ERROR
     code: Invalid (0x2200)
  message: Missing mandatory PRIMARY KEY part c
update lwt set v=1 where p=1 if s=1 and v=1;
   status: ERROR
     code: Invalid (0x2200)
  message: Missing mandatory PRIMARY KEY part c
update lwt set s=1 where p=1 if v=1;
   status: ERROR
     code: Invalid (0x2200)
  message: Missing mandatory PRIMARY KEY part c
update lwt set s=1 where p=1 if v=1 and s=1;
   status: ERROR
     code: Invalid (0x2200)
  message: Missing mandatory PRIMARY KEY part c
update lwt set s=1 where p=1 and c=1 if s=1;
   status: ERROR
     code: Invalid (0x2200)
  message: Invalid restrictions on clustering columns since the UPDATE statement modifies o
update lwt set s=1 where p=1 and c=1 if exists;
   status: ERROR
     code: Invalid (0x2200)
  message: Invalid restrictions on clustering columns since the UPDATE statement modifies o
delete from lwt where p=1 if exists;
   status: ERROR
     code: Invalid (0x2200)
  message: DELETE statements must restrict all PRIMARY KEY columns with equality relations 
delete from lwt where p=1 if v=10;
   status: ERROR
     code: Invalid (0x2200)
  message: DELETE statements must restrict all PRIMARY KEY columns with equality relations 
delete from lwt where p=1 and c>0 if exists;
   status: ERROR
     code: Invalid (0x2200)
  message: DELETE statements must restrict all PRIMARY KEY columns with equality relations 
delete from lwt where p=1 and c>0 if v=10;
   status: ERROR
     code: Invalid (0x2200)
  message: DELETE statements must restrict all PRIMARY KEY columns with equality relations 
delete v from lwt where p=1 if exists;
   status: ERROR
     code: Invalid (0x2200)
  message: Primary key column 'c' must be specified in order to modify column 'v'
delete v from lwt where p=1 if v=10;
   status: ERROR
     code: Invalid (0x2200)
  message: Primary key column 'c' must be specified in order to modify column 'v'
delete v from lwt where p=1 and c>0 if exists;
   status: ERROR
     code: Invalid (0x2200)
  message: DELETE statements must restrict all PRIMARY KEY columns with equality relations 
delete v from lwt where p=1 and c>0 if v=10;
   status: ERROR
     code: Invalid (0x2200)
  message: DELETE statements must restrict all PRIMARY KEY columns with equality relations 
delete s from lwt where p=1 if v=1;
   status: ERROR
     code: Invalid (0x2200)
  message: DELETE statements must restrict all PRIMARY KEY columns with equality relations 
delete s from lwt where p=1 if v=1 and s=1;
   status: ERROR
     code: Invalid (0x2200)
  message: DELETE statements must restrict all PRIMARY KEY columns with equality relations 
delete s from lwt where p=1 and c=1 if s=1;
   status: ERROR
     code: Invalid (0x2200)
  message: Invalid restrictions on clustering columns since the DELETE statement modifies o
delete s from lwt where p=1 and c=1 if exists;
   status: ERROR
     code: Invalid (0x2200)
  message: Invalid restrictions on clustering columns since the DELETE statement modifies o
drop table lwt;
  OK

-- mixing reading operations and static column conditions in one statement
create table lwt(p int, c int, s int static, v list<int>, primary key(p, c));
  OK
insert into lwt(p, c) values(1, 1);
  OK
insert into lwt(p, c, v) values(1, 2, [1, 2, 3]);
  OK
insert into lwt(p, c, s) values(1, 3, 1);
  OK
update lwt set v=v-[2] where p=1 and c=2 if s=1;
  +-----------+---+
  | [APPLIED] | S |
  +-----------+---+
  | true      | 1 |
  +-----------+---+
select * from lwt;
  +---+---+---+-------+
  | P | C | S |   V   |
  +---+---+---+-------+
  | 1 | 1 | 1 | []    |
  | 1 | 2 | 1 | [1 3] |
  | 1 | 3 | 1 | []    |
  +---+---+---+-------+
drop table lwt;
  OK

-- todo: conditional updates and views

--
-- collections: conditional updates and sets, maps, lists, frozen
-- sets, maps and lists
--
create table lwt (a int, b int, setint set<int>, setsetint set<frozen<set<int>>>, primary key (a, b));
  OK
insert into test (a, b) values (1,1);
   status: ERROR
     code: Invalid (0x2200)
  message: unconfigured table test
update lwt set setint={1, 2, 3}, setsetint = {{1,2,3}, {2,3,4}, {5,6,7}} where a = 1 and b = 1 if exists;
  +-----------+---+---+--------+-----------+
  | [APPLIED] | A | B | SETINT | SETSETINT |
  +-----------+---+---+--------+-----------+
  | false     | 0 | 0 | []     | []        |
  +-----------+---+---+--------+-----------+
select * from lwt allow filtering;
  OK
update lwt set setint=setint+{1, 2, 3}, setsetint = setsetint + {{7,8,9}} where a = 1 and b = 1 if setint = {1, 2, 3};
  +-----------+--------+
  | [APPLIED] | SETINT |
  +-----------+--------+
  | false     | []     |
  +-----------+--------+
select * from lwt allow filtering;
  OK
update lwt set setint=setint-{1, 2, 3}, setsetint = setsetint - {{1,2,3}} where a = 1 and b = 1  if exists;
  +-----------+---+---+--------+-----------+
  | [APPLIED] | A | B | SETINT | SETSETINT |
  +-----------+---+---+--------+-----------+
  | false     | 0 | 0 | []     | []        |
  +-----------+---+---+--------+-----------+
select * from lwt allow filtering;
  OK
drop table lwt;
  OK

create table lwt (a int, b int, mapint map<int, int>, mapsetint map<int, frozen<set<int>>>, primary key (a, b));
  OK
insert into lwt (a, b) values (1,1);
  OK
update lwt set mapint={1: 1, 2: 1, 3: 1}, mapsetint = {1: {1}, 2: {2}, 3: {3}} where a = 1 and b = 1 if exists;
  +-----------+---+---+--------+-----------+
  | [APPLIED] | A | B | MAPINT | MAPSETINT |
  +-----------+---+---+--------+-----------+
  | true      | 1 | 1 | map[]  | map[]     |
  +-----------+---+---+--------+-----------+
select * from lwt allow filtering;
  +---+---+------------------+------------------------+
  | A | B |      MAPINT      |       MAPSETINT        |
  +---+---+------------------+------------------------+
  | 1 | 1 | map[1:1 2:1 3:1] | map[1:[1] 2:[2] 3:[3]] |
  +---+---+------------------+------------------------+
update lwt set mapsetint = mapsetint + {1: {3,4}} where a = 1 and b = 1 if mapint[2] = 1;
  +-----------+------------------+
  | [APPLIED] |      MAPINT      |
  +-----------+------------------+
  | true      | map[1:1 2:1 3:1] |
  +-----------+------------------+
select * from lwt allow filtering;
  +---+---+------------------+--------------------------+
  | A | B |      MAPINT      |        MAPSETINT         |
  +---+---+------------------+--------------------------+
  | 1 | 1 | map[1:1 2:1 3:1] | map[1:[3 4] 2:[2] 3:[3]] |
  +---+---+------------------+--------------------------+
update lwt set mapint = mapint + {2: 1} where a = 1 and b = 1 if exists;
  +-----------+---+---+------------------+--------------------------+
  | [APPLIED] | A | B |      MAPINT      |        MAPSETINT         |
  +-----------+---+---+------------------+--------------------------+
  | true      | 1 | 1 | map[1:1 2:1 3:1] | map[1:[3 4] 2:[2] 3:[3]] |
  +-----------+---+---+------------------+--------------------------+
update lwt set mapint = mapint - {2} where a = 1 and b = 1 if exists;
  +-----------+---+---+------------------+--------------------------+
  | [APPLIED] | A | B |      MAPINT      |        MAPSETINT         |
  +-----------+---+---+------------------+--------------------------+
  | true      | 1 | 1 | map[1:1 2:1 3:1] | map[1:[3 4] 2:[2] 3:[3]] |
  +-----------+---+---+------------------+--------------------------+
select * from lwt allow filtering;
  +---+---+--------------+--------------------------+
  | A | B |    MAPINT    |        MAPSETINT         |
  +---+---+--------------+--------------------------+
  | 1 | 1 | map[1:1 3:1] | map[1:[3 4] 2:[2] 3:[3]] |
  +---+---+--------------+--------------------------+
drop table lwt;
  OK

create table lwt (a int, b int, listint list<int>, staticsettext set<text> static, primary key(a, b));
  OK
insert into lwt (a, b) values (1,1);
  OK
update lwt set staticsettext = {'a', 'b', 'c'} where a = 1 if exists;
  +-----------+---+---+---------------+---------+
  | [APPLIED] | A | B | STATICSETTEXT | LISTINT |
  +-----------+---+---+---------------+---------+
  | false     | 1 | 1 | []            | []      |
  +-----------+---+---+---------------+---------+
select * from lwt allow filtering;
  +---+---+---------------+---------+
  | A | B | STATICSETTEXT | LISTINT |
  +---+---+---------------+---------+
  | 1 | 1 | []            | []      |
  +---+---+---------------+---------+
update lwt set staticsettext = {'d', 'e', 'f'} where a = 2 if exists;
  +-----------+---+---+---------------+---------+
  | [APPLIED] | A | B | STATICSETTEXT | LISTINT |
  +-----------+---+---+---------------+---------+
  | false     | 0 | 0 | []            | []      |
  +-----------+---+---+---------------+---------+
select * from lwt allow filtering;
  +---+---+---------------+---------+
  | A | B | STATICSETTEXT | LISTINT |
  +---+---+---------------+---------+
  | 1 | 1 | []            | []      |
  +---+---+---------------+---------+
update lwt set staticsettext = staticsettext + {'d'}, listint = [1, 2, 3] where a = 1 and b = 1 if exists;
  +-----------+---+---+---------------+---------+
  | [APPLIED] | A | B | STATICSETTEXT | LISTINT |
  +-----------+---+---+---------------+---------+
  | true      | 1 | 1 | []            | []      |
  +-----------+---+---+---------------+---------+
select * from lwt allow filtering;
  +---+---+---------------+---------+
  | A | B | STATICSETTEXT | LISTINT |
  +---+---+---------------+---------+
  | 1 | 1 | [d]           | [1 2 3] |
  +---+---+---------------+---------+
update lwt set staticsettext = staticsettext + {'e'} where a = 1 if exists;
  +-----------+---+---+---------------+---------+
  | [APPLIED] | A | B | STATICSETTEXT | LISTINT |
  +-----------+---+---+---------------+---------+
  | true      | 1 | 1 | [d]           | [1 2 3] |
  +-----------+---+---+---------------+---------+
select * from lwt allow filtering;
  +---+---+---------------+---------+
  | A | B | STATICSETTEXT | LISTINT |
  +---+---+---------------+---------+
  | 1 | 1 | [d e]         | [1 2 3] |
  +---+---+---------------+---------+
update lwt set listint = listint + [5] where a = 1 and b = 1 if exists;
  +-----------+---+---+---------------+---------+
  | [APPLIED] | A | B | STATICSETTEXT | LISTINT |
  +-----------+---+---+---------------+---------+
  | true      | 1 | 1 | [d e]         | [1 2 3] |
  +-----------+---+---+---------------+---------+
select * from lwt allow filtering;
  +---+---+---------------+-----------+
  | A | B | STATICSETTEXT |  LISTINT  |
  +---+---+---------------+-----------+
  | 1 | 1 | [d e]         | [1 2 3 5] |
  +---+---+---------------+-----------+
update lwt set listint = [-1] + listint, staticsettext = staticsettext - {'e'} where a = 1 and b = 1 if exists;
  +-----------+---+---+---------------+-----------+
  | [APPLIED] | A | B | STATICSETTEXT |  LISTINT  |
  +-----------+---+---+---------------+-----------+
  | true      | 1 | 1 | [d e]         | [1 2 3 5] |
  +-----------+---+---+---------------+-----------+
select * from lwt allow filtering;
  +---+---+---------------+--------------+
  | A | B | STATICSETTEXT |   LISTINT    |
  +---+---+---------------+--------------+
  | 1 | 1 | [d]           | [-1 1 2 3 5] |
  +---+---+---------------+--------------+
drop table lwt;
  OK

create table lwt (a int, b int, flistint frozen<list<int>>, smapint map<text, int> static, primary key(a, b));
  OK
insert into lwt (a, b) values (1,1);
  OK
update lwt set smapint = {'a': 1, 'b': 1, 'c': 3} where a = 1 if exists;
  +-----------+---+---+---------+----------+
  | [APPLIED] | A | B | SMAPINT | FLISTINT |
  +-----------+---+---+---------+----------+
  | false     | 1 | 1 | map[]   | []       |
  +-----------+---+---+---------+----------+
select * from lwt allow filtering;
  +---+---+---------+----------+
  | A | B | SMAPINT | FLISTINT |
  +---+---+---------+----------+
  | 1 | 1 | map[]   | []       |
  +---+---+---------+----------+
update lwt set smapint = smapint + {'d': 3}, flistint = [1] where a = 1 if exists;
   status: ERROR
     code: Invalid (0x2200)
  message: Missing mandatory PRIMARY KEY part b
update lwt set smapint = smapint + {'d': 4}, flistint = [1] where a = 1 and b = 1 if exists;
  +-----------+---+---+---------+----------+
  | [APPLIED] | A | B | SMAPINT | FLISTINT |
  +-----------+---+---+---------+----------+
  | true      | 1 | 1 | map[]   | []       |
  +-----------+---+---+---------+----------+
select * from lwt allow filtering;
  +---+---+----------+----------+
  | A | B | SMAPINT  | FLISTINT |
  +---+---+----------+----------+
  | 1 | 1 | map[d:4] | [1]      |
  +---+---+----------+----------+
update lwt set flistint = [1, 2] where a = 1 and b = 1 if exists;
  +-----------+---+---+----------+----------+
  | [APPLIED] | A | B | SMAPINT  | FLISTINT |
  +-----------+---+---+----------+----------+
  | true      | 1 | 1 | map[d:4] | [1]      |
  +-----------+---+---+----------+----------+
select * from lwt allow filtering;
  +---+---+----------+----------+
  | A | B | SMAPINT  | FLISTINT |
  +---+---+----------+----------+
  | 1 | 1 | map[d:4] | [1 2]    |
  +---+---+----------+----------+
update lwt set flistint = flistint + [3] where a = 1 and b = 1 if exists;
   status: ERROR
     code: Invalid (0x2200)
  message: Invalid operation (flistint = flistint + [3]) for frozen collection column 666c6
select * from lwt allow filtering;
  +---+---+----------+----------+
  | A | B | SMAPINT  | FLISTINT |
  +---+---+----------+----------+
  | 1 | 1 | map[d:4] | [1 2]    |
  +---+---+----------+----------+
update lwt set flistint = [4]  where a = 1 and b = 1 if smapint['a'] = 1;
  +-----------+----------+
  | [APPLIED] | SMAPINT  |
  +-----------+----------+
  | false     | map[d:4] |
  +-----------+----------+
update lwt set flistint = [4]  where a = 1 and b = 1;
  OK
drop table lwt;
  OK
--
-- collection: ends
--
--
-- if expr grammar
--
create table lwt (a int, c int, listint list<int>, mapint map<int, int>, setint set<int>, primary key(a));
  OK
-- term
update lwt set c=0 where a = 1 if c;
   status: ERROR
     code: Syntax error (0x2000)
  message: line 1:35 no viable alternative at input ';'
-- -- equality
update lwt set c=0 where a = 1 if c = 1;
  +-----------+---+
  | [APPLIED] | C |
  +-----------+---+
  | false     | 0 |
  +-----------+---+
-- inequality: there is na inequality
update lwt set c=0 where a = 1 if c != 1;
  +-----------+---+
  | [APPLIED] | C |
  +-----------+---+
  | true      | 0 |
  +-----------+---+
-- greater
update lwt set c=0 where a = 1 if c > 1;
  +-----------+---+
  | [APPLIED] | C |
  +-----------+---+
  | false     | 0 |
  +-----------+---+
-- less
update lwt set c=0 where a = 1 if c < 1;
  +-----------+---+
  | [APPLIED] | C |
  +-----------+---+
  | true      | 0 |
  +-----------+---+
-- greater equal
update lwt set c=0 where a = 1 if c >= 1;
  +-----------+---+
  | [APPLIED] | C |
  +-----------+---+
  | false     | 0 |
  +-----------+---+
-- less equal
update lwt set c=0 where a = 1 if c <= 1;
  +-----------+---+
  | [APPLIED] | C |
  +-----------+---+
  | true      | 0 |
  +-----------+---+
-- AND prediate
update lwt set c=0 where a = 1 if c = 1 and c = 1;
  +-----------+---+
  | [APPLIED] | C |
  +-----------+---+
  | false     | 0 |
  +-----------+---+
-- OR predicate: Cassandra users do not deserve it :(
update lwt set c=0 where a = 1 if c = 1 or c = 1;
   status: ERROR
     code: Syntax error (0x2000)
  message: line 1:40  : syntax error...
-- null
update lwt set c=0 where a = 1 if c = null;
  +-----------+---+
  | [APPLIED] | C |
  +-----------+---+
  | false     | 0 |
  +-----------+---+
-- in
update lwt set c=0 where a = 1 if c in (1);
  +-----------+---+
  | [APPLIED] | C |
  +-----------+---+
  | false     | 0 |
  +-----------+---+
-- in
update lwt set c=0 where a = 1 if c in (1, 2);
  +-----------+---+
  | [APPLIED] | C |
  +-----------+---+
  | false     | 0 |
  +-----------+---+
-- in (null)
update lwt set c=0 where a = 1 if c in (1, null);
  +-----------+---+
  | [APPLIED] | C |
  +-----------+---+
  | false     | 0 |
  +-----------+---+
-- list contains
update lwt set c=0 where a = 1 if listint contains null;
   status: ERROR
     code: Syntax error (0x2000)
  message: line 1:42 no viable alternative at input 'contains'
-- map contains
update lwt set c=0 where a = 1 if mapint contains key 1;
   status: ERROR
     code: Syntax error (0x2000)
  message: line 1:41 no viable alternative at input 'contains'
-- set contains
update lwt set c=0 where a = 1 if setint contains key 1;
   status: ERROR
     code: Syntax error (0x2000)
  message: line 1:41 no viable alternative at input 'contains'
-- multi-value set contaias
update lwt set c=0 where a = 1 if setint contains key 1;
   status: ERROR
     code: Syntax error (0x2000)
  message: line 1:41 no viable alternative at input 'contains'
-- addressing map element
update lwt set c=0 where a = 1 if mapint[2] = 3;
  +-----------+--------+
  | [APPLIED] | MAPINT |
  +-----------+--------+
  | false     | map[]  |
  +-----------+--------+
-- addressing map element
update lwt set c=0 where a = 1 if mapint[2];
   status: ERROR
     code: Syntax error (0x2000)
  message: line 1:43 no viable alternative at input ';'
-- comparing map element and null
update lwt set c=0 where a = 1 if mapint[2] = null;
  +-----------+--------+
  | [APPLIED] | MAPINT |
  +-----------+--------+
  | true      | map[]  |
  +-----------+--------+
-- rinse and repeat with actual data
insert into lwt (a, c, listint, mapint, setint) values (1, 1, [1], {1: 1}, {1});
  OK
update lwt set c=1 where a = 1 if c = 0;
  +-----------+---+
  | [APPLIED] | C |
  +-----------+---+
  | false     | 1 |
  +-----------+---+
select * from lwt allow filtering;
  +---+---+---------+----------+--------+
  | A | C | LISTINT |  MAPINT  | SETINT |
  +---+---+---------+----------+--------+
  | 1 | 1 | [1]     | map[1:1] | [1]    |
  +---+---+---------+----------+--------+
update lwt set c=2 where a = 1 if c != 1;
  +-----------+---+
  | [APPLIED] | C |
  +-----------+---+
  | false     | 1 |
  +-----------+---+
select * from lwt allow filtering;
  +---+---+---------+----------+--------+
  | A | C | LISTINT |  MAPINT  | SETINT |
  +---+---+---------+----------+--------+
  | 1 | 1 | [1]     | map[1:1] | [1]    |
  +---+---+---------+----------+--------+
update lwt set c=3 where a = 1 if c > 0;
  +-----------+---+
  | [APPLIED] | C |
  +-----------+---+
  | true      | 1 |
  +-----------+---+
select * from lwt allow filtering;
  +---+---+---------+----------+--------+
  | A | C | LISTINT |  MAPINT  | SETINT |
  +---+---+---------+----------+--------+
  | 1 | 3 | [1]     | map[1:1] | [1]    |
  +---+---+---------+----------+--------+
update lwt set c=4 where a = 1 if c < 2;
  +-----------+---+
  | [APPLIED] | C |
  +-----------+---+
  | false     | 3 |
  +-----------+---+
select * from lwt allow filtering;
  +---+---+---------+----------+--------+
  | A | C | LISTINT |  MAPINT  | SETINT |
  +---+---+---------+----------+--------+
  | 1 | 3 | [1]     | map[1:1] | [1]    |
  +---+---+---------+----------+--------+
update lwt set c=5 where a = 1 if c >= 1;
  +-----------+---+
  | [APPLIED] | C |
  +-----------+---+
  | true      | 3 |
  +-----------+---+
select * from lwt allow filtering;
  +---+---+---------+----------+--------+
  | A | C | LISTINT |  MAPINT  | SETINT |
  +---+---+---------+----------+--------+
  | 1 | 5 | [1]     | map[1:1] | [1]    |
  +---+---+---------+----------+--------+
update lwt set c=6 where a = 1 if c <= 5;
  +-----------+---+
  | [APPLIED] | C |
  +-----------+---+
  | true      | 5 |
  +-----------+---+
select * from lwt allow filtering;
  +---+---+---------+----------+--------+
  | A | C | LISTINT |  MAPINT  | SETINT |
  +---+---+---------+----------+--------+
  | 1 | 6 | [1]     | map[1:1] | [1]    |
  +---+---+---------+----------+--------+
update lwt set c=7 where a = 1 if c = 1 and c = 1;
  +-----------+---+
  | [APPLIED] | C |
  +-----------+---+
  | false     | 6 |
  +-----------+---+
select * from lwt allow filtering;
  +---+---+---------+----------+--------+
  | A | C | LISTINT |  MAPINT  | SETINT |
  +---+---+---------+----------+--------+
  | 1 | 6 | [1]     | map[1:1] | [1]    |
  +---+---+---------+----------+--------+
update lwt set c=8 where a = 1 if c = null;
  +-----------+---+
  | [APPLIED] | C |
  +-----------+---+
  | false     | 6 |
  +-----------+---+
select * from lwt allow filtering;
  +---+---+---------+----------+--------+
  | A | C | LISTINT |  MAPINT  | SETINT |
  +---+---+---------+----------+--------+
  | 1 | 6 | [1]     | map[1:1] | [1]    |
  +---+---+---------+----------+--------+
update lwt set c=9 where a = 1 if c in (4);
  +-----------+---+
  | [APPLIED] | C |
  +-----------+---+
  | false     | 6 |
  +-----------+---+
select * from lwt allow filtering;
  +---+---+---------+----------+--------+
  | A | C | LISTINT |  MAPINT  | SETINT |
  +---+---+---------+----------+--------+
  | 1 | 6 | [1]     | map[1:1] | [1]    |
  +---+---+---------+----------+--------+
update lwt set c=10 where a = 1 if c in (4, 5);
  +-----------+---+
  | [APPLIED] | C |
  +-----------+---+
  | false     | 6 |
  +-----------+---+
select * from lwt allow filtering;
  +---+---+---------+----------+--------+
  | A | C | LISTINT |  MAPINT  | SETINT |
  +---+---+---------+----------+--------+
  | 1 | 6 | [1]     | map[1:1] | [1]    |
  +---+---+---------+----------+--------+
update lwt set c=11 where a = 1 if c in (5, null);
  +-----------+---+
  | [APPLIED] | C |
  +-----------+---+
  | false     | 6 |
  +-----------+---+
select * from lwt allow filtering;
  +---+---+---------+----------+--------+
  | A | C | LISTINT |  MAPINT  | SETINT |
  +---+---+---------+----------+--------+
  | 1 | 6 | [1]     | map[1:1] | [1]    |
  +---+---+---------+----------+--------+
update lwt set c=12 where a = 1 if mapint[1] = 1;
  +-----------+----------+
  | [APPLIED] |  MAPINT  |
  +-----------+----------+
  | true      | map[1:1] |
  +-----------+----------+
select * from lwt allow filtering;
  +---+----+---------+----------+--------+
  | A | C  | LISTINT |  MAPINT  | SETINT |
  +---+----+---------+----------+--------+
  | 1 | 12 | [1]     | map[1:1] | [1]    |
  +---+----+---------+----------+--------+
update lwt set c=13 where a = 1 if mapint[1] = null;
  +-----------+----------+
  | [APPLIED] |  MAPINT  |
  +-----------+----------+
  | false     | map[1:1] |
  +-----------+----------+
select * from lwt allow filtering;
  +---+----+---------+----------+--------+
  | A | C  | LISTINT |  MAPINT  | SETINT |
  +---+----+---------+----------+--------+
  | 1 | 12 | [1]     | map[1:1] | [1]    |
  +---+----+---------+----------+--------+
drop table lwt;
  OK
--
-- conditions: null handling
--
create table lwt (a int, b int, primary key(a));
  OK
insert into lwt (a) values (1);
  OK
-- null >|<|<=|<= val = false
update lwt set b = 1 where a = 1 if b > 3;
  +-----------+---+
  | [APPLIED] | B |
  +-----------+---+
  | false     | 0 |
  +-----------+---+
update lwt set b = 1 where a = 1 if b >= 3;
  +-----------+---+
  | [APPLIED] | B |
  +-----------+---+
  | false     | 0 |
  +-----------+---+
update lwt set b = 1 where a = 1 if b <= 3;
  +-----------+---+
  | [APPLIED] | B |
  +-----------+---+
  | false     | 0 |
  +-----------+---+
update lwt set b = 1 where a = 1 if b < 3;
  +-----------+---+
  | [APPLIED] | B |
  +-----------+---+
  | false     | 0 |
  +-----------+---+
-- null >|<|<=|<= null = error
update lwt set b = 1 where a = 1 if b > null;
   status: ERROR
     code: Invalid (0x2200)
  message: Invalid comparison with null for operator ">"
update lwt set b = 1 where a = 1 if b >= null;
   status: ERROR
     code: Invalid (0x2200)
  message: Invalid comparison with null for operator ">="
update lwt set b = 1 where a = 1 if b < null;
   status: ERROR
     code: Invalid (0x2200)
  message: Invalid comparison with null for operator "<"
update lwt set b = 1 where a = 1 if b <= null;
   status: ERROR
     code: Invalid (0x2200)
  message: Invalid comparison with null for operator "<="
-- cassandra doesn't allow this (ugh), but test nevertheless
update lwt set b = 1 where a = 1 if 3 < b;
   status: ERROR
     code: Syntax error (0x2000)
  message: line 1:36 no viable alternative at input '3'
update lwt set b = 1 where a = 1 if 3 <= b;
   status: ERROR
     code: Syntax error (0x2000)
  message: line 1:36 no viable alternative at input '3'
update lwt set b = 1 where a = 1 if 3 >= b;
   status: ERROR
     code: Syntax error (0x2000)
  message: line 1:36 no viable alternative at input '3'
update lwt set b = 1 where a = 1 if 3 > b;
   status: ERROR
     code: Syntax error (0x2000)
  message: line 1:36 no viable alternative at input '3'
update lwt set b = 1 where a = 1 if null < b;
   status: ERROR
     code: Syntax error (0x2000)
  message: line 1:36 no viable alternative at input 'null'
update lwt set b = 1 where a = 1 if null <= b;
   status: ERROR
     code: Syntax error (0x2000)
  message: line 1:36 no viable alternative at input 'null'
update lwt set b = 1 where a = 1 if null > b;
   status: ERROR
     code: Syntax error (0x2000)
  message: line 1:36 no viable alternative at input 'null'
update lwt set b = 1 where a = 1 if null >= b;
   status: ERROR
     code: Syntax error (0x2000)
  message: line 1:36 no viable alternative at input 'null'
update lwt set b = 1 where a = 1 if null = b;
   status: ERROR
     code: Syntax error (0x2000)
  message: line 1:36 no viable alternative at input 'null'
-- null == null = true
update lwt set b = 1 where a = 1 if b = null;
  +-----------+---+
  | [APPLIED] | B |
  +-----------+---+
  | true      | 0 |
  +-----------+---+
select * from lwt allow filtering;
  +---+---+
  | A | B |
  +---+---+
  | 1 | 1 |
  +---+---+
-- val !=  null = true
update lwt set b = null where a = 1 if b != null;
  +-----------+---+
  | [APPLIED] | B |
  +-----------+---+
  | true      | 1 |
  +-----------+---+
select * from lwt allow filtering;
  +---+---+
  | A | B |
  +---+---+
  | 1 | 0 |
  +---+---+
update lwt set b = null where a = 1;
  OK
select * from lwt allow filtering;
  +---+---+
  | A | B |
  +---+---+
  | 1 | 0 |
  +---+---+
-- null != null  = false
update lwt set b = 1 where a = 1 if b != null;
  +-----------+---+
  | [APPLIED] | B |
  +-----------+---+
  | false     | 0 |
  +-----------+---+
select * from lwt allow filtering;
  +---+---+
  | A | B |
  +---+---+
  | 1 | 0 |
  +---+---+
-- null != val  = true
update lwt set b = 2 where a = 1 if b != 1;
  +-----------+---+
  | [APPLIED] | B |
  +-----------+---+
  | true      | 0 |
  +-----------+---+
select * from lwt allow filtering;
  +---+---+
  | A | B |
  +---+---+
  | 1 | 2 |
  +---+---+
drop table lwt;
  OK
--
-- conditions: simple expression
--
create table lwt (a int, b boolean, d decimal, f double, i int, s text, t timestamp, primary key(a));
  OK
insert into lwt (a, b, d, f, i, s, t) values (1, true, 1, 1, 1, '', dateof(now()));
  OK
-- boolean test
update lwt set b = false where a = 1 if b = true;
  +-----------+------+
  | [APPLIED] |  B   |
  +-----------+------+
  | true      | true |
  +-----------+------+
select b from lwt where a = 1;
  +-------+
  |   B   |
  +-------+
  | false |
  +-------+
update lwt set b = true where a = 1 if b = true;
  +-----------+-------+
  | [APPLIED] |   B   |
  +-----------+-------+
  | false     | false |
  +-----------+-------+
select b from lwt where a = 1;
  +-------+
  |   B   |
  +-------+
  | false |
  +-------+
update lwt set b = true where a = 1 if b != true;
  +-----------+-------+
  | [APPLIED] |   B   |
  +-----------+-------+
  | true      | false |
  +-----------+-------+
-- for whatever reason these operators are allowed for boolean values,
-- keep it this way
update lwt set b = true where a = 1 if b > true;
  +-----------+------+
  | [APPLIED] |  B   |
  +-----------+------+
  | false     | true |
  +-----------+------+
update lwt set b = true where a = 1 if b < false;
  +-----------+------+
  | [APPLIED] |  B   |
  +-----------+------+
  | false     | true |
  +-----------+------+
update lwt set b = true where a = 1 if b <= false;
  +-----------+------+
  | [APPLIED] |  B   |
  +-----------+------+
  | false     | true |
  +-----------+------+
update lwt set b = true where a = 1 if b >= true;
  +-----------+------+
  | [APPLIED] |  B   |
  +-----------+------+
  | true      | true |
  +-----------+------+
-- integer test
update lwt set i = 1 where a = 1 if i = 1;
  +-----------+---+
  | [APPLIED] | I |
  +-----------+---+
  | true      | 1 |
  +-----------+---+
update lwt set i = 2 where a = 1 if i != 1;
  +-----------+---+
  | [APPLIED] | I |
  +-----------+---+
  | false     | 1 |
  +-----------+---+
update lwt set i = 3 where a = 1 if i < 1;
  +-----------+---+
  | [APPLIED] | I |
  +-----------+---+
  | false     | 1 |
  +-----------+---+
update lwt set i = 4 where a = 1 if i > 1;
  +-----------+---+
  | [APPLIED] | I |
  +-----------+---+
  | false     | 1 |
  +-----------+---+
update lwt set i = 5 where a = 1 if i >= 1;
  +-----------+---+
  | [APPLIED] | I |
  +-----------+---+
  | true      | 1 |
  +-----------+---+
update lwt set i = 6 where a = 1 if i <= 1;
  +-----------+---+
  | [APPLIED] | I |
  +-----------+---+
  | false     | 5 |
  +-----------+---+
-- Compare with another column: cassandra doesnt allow anyting but a
-- constant on the right hand side :(
update lwt set i = 7 where a = 1 if i = t;
   status: ERROR
     code: Syntax error (0x2000)
  message: line 1:41 no viable alternative at input ';'
update lwt set i = 7 where a = 1 if i = d;
   status: ERROR
     code: Syntax error (0x2000)
  message: line 1:41 no viable alternative at input ';'
update lwt set i = 7 where a = 1 if i = f;
   status: ERROR
     code: Syntax error (0x2000)
  message: line 1:41 no viable alternative at input ';'
update lwt set i = 7 where a = 1 if s = i;
   status: ERROR
     code: Syntax error (0x2000)
  message: line 1:41 no viable alternative at input ';'
-- float test
update lwt set f = 2 where a = 1 if f = 1;
  +-----------+---+
  | [APPLIED] | F |
  +-----------+---+
  | true      | 1 |
  +-----------+---+
update lwt set f = 3 where a = 1 if f != 1;
  +-----------+---+
  | [APPLIED] | F |
  +-----------+---+
  | true      | 2 |
  +-----------+---+
update lwt set f = 4 where a = 1 if f < 1;
  +-----------+---+
  | [APPLIED] | F |
  +-----------+---+
  | false     | 3 |
  +-----------+---+
update lwt set f = 5 where a = 1 if f > 1;
  +-----------+---+
  | [APPLIED] | F |
  +-----------+---+
  | true      | 3 |
  +-----------+---+
update lwt set f = 6 where a = 1 if f >= 1;
  +-----------+---+
  | [APPLIED] | F |
  +-----------+---+
  | true      | 5 |
  +-----------+---+
update lwt set f = 7 where a = 1 if f <= 1;
  +-----------+---+
  | [APPLIED] | F |
  +-----------+---+
  | false     | 6 |
  +-----------+---+
-- this is broken, obviously
update lwt set f = 8 where a = 1 if f != 6.0000000000000001;
  +-----------+---+
  | [APPLIED] | F |
  +-----------+---+
  | false     | 6 |
  +-----------+---+
-- decimal
update lwt set d = 2.1 where a = 1 if d = 1;
  +-----------+---+
  | [APPLIED] | D |
  +-----------+---+
  | true      | 1 |
  +-----------+---+
update lwt set d = 3.2 where a = 1 if d != 2.09999999999999999999999999999999999;
  +-----------+-----+
  | [APPLIED] |  D  |
  +-----------+-----+
  | true      | 2.1 |
  +-----------+-----+
update lwt set d = 4.3 where a = 1 if d < 3.2;
  +-----------+-----+
  | [APPLIED] |  D  |
  +-----------+-----+
  | false     | 3.2 |
  +-----------+-----+
update lwt set d = 5.4 where a = 1 if d > 3.2;
  +-----------+-----+
  | [APPLIED] |  D  |
  +-----------+-----+
  | false     | 3.2 |
  +-----------+-----+
update lwt set d = 6.5 where a = 1 if d >= 3.2;
  +-----------+-----+
  | [APPLIED] |  D  |
  +-----------+-----+
  | true      | 3.2 |
  +-----------+-----+
update lwt set d = 7.6 where a = 1 if d <= 6.5;
  +-----------+-----+
  | [APPLIED] |  D  |
  +-----------+-----+
  | true      | 6.5 |
  +-----------+-----+
-- text
update lwt set s = 'i' where a = 1 if s = '';
  +-----------+---+
  | [APPLIED] | S |
  +-----------+---+
  | true      |   |
  +-----------+---+
update lwt set s = 'щ' where a = 1 if s != 'j';
  +-----------+---+
  | [APPLIED] | S |
  +-----------+---+
  | true      | i |
  +-----------+---+
-- wheeled charriot and left-to-right
update lwt set s = ' 𐃌   ' where a = 1 if s < 'я';
  +-----------+---+
  | [APPLIED] | S |
  +-----------+---+
  | true      | щ |
  +-----------+---+
update lwt set s = 'שׁלום' where a = 1 if s >= '1';
  +-----------+-------+
  | [APPLIED] |   S   |
  +-----------+-------+
  | false     |  𐃌    |
  +-----------+-------+
select s from lwt where a = 1;
  +-------+
  |   S   |
  +-------+
  |  𐃌    |
  +-------+
-- timestamp test
-- update lwt set t = dateof(now()) where a = 1 if t <= dateof(now());
drop table lwt;
  OK
-- map keys
create table lwt (a int, b map<boolean, boolean>, c list<boolean>, s set<boolean>, primary key (a));
  OK
insert into lwt (a, b) values (1, {true: true});
  OK
update lwt set b = {true:false} where a = 1 if b[true] = true;
  +-----------+----------------+
  | [APPLIED] |       B        |
  +-----------+----------------+
  | true      | map[true:true] |
  +-----------+----------------+
update lwt set b = {true:false} where a = 1 if b[true] = null;
  +-----------+-----------------+
  | [APPLIED] |        B        |
  +-----------+-----------------+
  | false     | map[true:false] |
  +-----------+-----------------+
update lwt set b = {false:true} where a = 1 if b[false] = null;
  +-----------+-----------------+
  | [APPLIED] |        B        |
  +-----------+-----------------+
  | true      | map[true:false] |
  +-----------+-----------------+
update lwt set b = {false:false} where a = 1 if b[true] != null;
  +-----------+-----------------+
  | [APPLIED] |        B        |
  +-----------+-----------------+
  | false     | map[false:true] |
  +-----------+-----------------+
update lwt set b[true] = false where a = 1 if b[true] != 1;
   status: ERROR
     code: Invalid (0x2200)
  message: Invalid INTEGER constant (1) for "value(b)" of type boolean
update lwt set b[false] = null where a = 1 if b[true] > null;
   status: ERROR
     code: Invalid (0x2200)
  message: Invalid comparison with null for operator ">"
update lwt set b[false] = true where a = 1 if b[1] != true;
   status: ERROR
     code: Invalid (0x2200)
  message: Invalid INTEGER constant (1) for "key(b)" of type boolean
update lwt set b = {true:false, true:true, false:false} where a = 1 if b[null] = null;
   status: ERROR
     code: Invalid (0x2200)
  message: Invalid null value for map<boolean, boolean> element access
update lwt set b = b + {false:true} where a = 1 if b[null] = true;
   status: ERROR
     code: Invalid (0x2200)
  message: Invalid null value for map<boolean, boolean> element access
update lwt set b[null] = false where a = 1 if b[true] != true;
   status: ERROR
     code: Invalid (0x2200)
  message: Invalid null map key
update lwt set b[null] = false where a = 1 if b[true] = true;
  +-----------+-----------------+
  | [APPLIED] |        B        |
  +-----------+-----------------+
  | false     | map[false:true] |
  +-----------+-----------------+
select b from lwt where a = 1;
  +-----------------+
  |        B        |
  +-----------------+
  | map[false:true] |
  +-----------------+
update lwt set b = {false:true} where a = 1 if b = {true:false};
  +-----------+-----------------+
  | [APPLIED] |        B        |
  +-----------+-----------------+
  | false     | map[false:true] |
  +-----------+-----------------+
update lwt set b = {} where a = 1 if exists;
  +-----------+---+-----------------+----+----+
  | [APPLIED] | A |        B        | C  | S  |
  +-----------+---+-----------------+----+----+
  | true      | 1 | map[false:true] | [] | [] |
  +-----------+---+-----------------+----+----+
update lwt set b = {} where a = 1 if b = {};
  +-----------+-------+
  | [APPLIED] |   B   |
  +-----------+-------+
  | true      | map[] |
  +-----------+-------+
select b from lwt where a = 1;
  +-------+
  |   B   |
  +-------+
  | map[] |
  +-------+
update lwt set b = {} where a = 1 if b = null;
  +-----------+-------+
  | [APPLIED] |   B   |
  +-----------+-------+
  | true      | map[] |
  +-----------+-------+
select b from lwt where a = 1;
  +-------+
  |   B   |
  +-------+
  | map[] |
  +-------+
update lwt set b = null where a = 1 if b = {};
  +-----------+-------+
  | [APPLIED] |   B   |
  +-----------+-------+
  | true      | map[] |
  +-----------+-------+
select b from lwt where a = 1;
  +-------+
  |   B   |
  +-------+
  | map[] |
  +-------+
-- lists
-- null value == empty list. see CASSANDRA-7155
update lwt set c = [false] where a = 1 if c = [];
  +-----------+----+
  | [APPLIED] | C  |
  +-----------+----+
  | true      | [] |
  +-----------+----+
-- c is null, really, so this should work
update lwt set c = [] where a = 1 if c = null;
  +-----------+---------+
  | [APPLIED] |    C    |
  +-----------+---------+
  | false     | [false] |
  +-----------+---------+
-- check with empty list
update lwt set c = [false] where a = 1 if c = [];
  +-----------+---------+
  | [APPLIED] |    C    |
  +-----------+---------+
  | false     | [false] |
  +-----------+---------+
update lwt set c = [false] where a = 1 if c = [false];
  +-----------+---------+
  | [APPLIED] |    C    |
  +-----------+---------+
  | true      | [false] |
  +-----------+---------+
update lwt set c = [false] where a = 1 if c = [null];
   status: ERROR
     code: Invalid (0x2200)
  message: null is not supported inside collections
update lwt set c = [false] where a = 1 if c = [null, true];
   status: ERROR
     code: Invalid (0x2200)
  message: null is not supported inside collections
select c from lwt where a = 1;
  +---------+
  |    C    |
  +---------+
  | [false] |
  +---------+
update lwt set c = [true, false] where a = 1 if c[0] = false;
  +-----------+---------+
  | [APPLIED] |    C    |
  +-----------+---------+
  | true      | [false] |
  +-----------+---------+
update lwt set c = c + [true] where a = 1 if c[1] = false;
  +-----------+--------------+
  | [APPLIED] |      C       |
  +-----------+--------------+
  | true      | [true false] |
  +-----------+--------------+
update lwt set c = c + [false] where a = 1 if c[2] = null;
  +-----------+-------------------+
  | [APPLIED] |         C         |
  +-----------+-------------------+
  | false     | [true false true] |
  +-----------+-------------------+
update lwt set c = c + [true] where a = 1 if c[3] = null;
  +-----------+-------------------+
  | [APPLIED] |         C         |
  +-----------+-------------------+
  | true      | [true false true] |
  +-----------+-------------------+
update lwt set c = c + [true] where a = 1 if c[100000000] = null;
  +-----------+------------------------+
  | [APPLIED] |           C            |
  +-----------+------------------------+
  | true      | [true false true true] |
  +-----------+------------------------+
update lwt set c = c + [false] where a = 1 if c[100000000] = true;
  +-----------+-----------------------------+
  | [APPLIED] |              C              |
  +-----------+-----------------------------+
  | false     | [true false true true true] |
  +-----------+-----------------------------+
update lwt set c = c + [true, false] where a = 1 if c[null] = false;
   status: ERROR
     code: Invalid (0x2200)
  message: Invalid null value for map<timeuuid, boolean> element access
update lwt set c = [false] where a = 1 if c[null] = null;
   status: ERROR
     code: Invalid (0x2200)
  message: Invalid null value for map<timeuuid, boolean> element access
update lwt set c = c + [false] where a = 1 if c[null] = 1;
   status: ERROR
     code: Invalid (0x2200)
  message: Invalid INTEGER constant (1) for "value(c)" of type boolean
update lwt set c = [true] + c where a = 1 if c = [false];
  +-----------+-----------------------------+
  | [APPLIED] |              C              |
  +-----------+-----------------------------+
  | false     | [true false true true true] |
  +-----------+-----------------------------+
select c from lwt where a = 1;
  +-----------------------------+
  |              C              |
  +-----------------------------+
  | [true false true true true] |
  +-----------------------------+
-- sets
-- null value == empty set
update lwt set s = {} where a = 1 if s = {};
  +-----------+----+
  | [APPLIED] | S  |
  +-----------+----+
  | true      | [] |
  +-----------+----+
update lwt set s = {} where a = 1 if s = null;
  +-----------+----+
  | [APPLIED] | S  |
  +-----------+----+
  | true      | [] |
  +-----------+----+
update lwt set s = {false} where a = 1 if s = null;
  +-----------+----+
  | [APPLIED] | S  |
  +-----------+----+
  | true      | [] |
  +-----------+----+
update lwt set s = {true, false} where a = 1 if s = {false};
  +-----------+---------+
  | [APPLIED] |    S    |
  +-----------+---------+
  | true      | [false] |
  +-----------+---------+
update lwt set s = {false} where a = 1 if s = {null};
   status: ERROR
     code: Invalid (0x2200)
  message: null is not supported inside collections
update lwt set s = {false} where a = 1 if s = {null, true};
   status: ERROR
     code: Invalid (0x2200)
  message: null is not supported inside collections
update lwt set s = {true, false} where a = 1 if s{true} = false;
   status: ERROR
     code: Syntax error (0x2000)
  message: line 1:49 no viable alternative at input '{'
update lwt set s = {false} where a = 1 if s = 1;
   status: ERROR
     code: Invalid (0x2200)
  message: Invalid INTEGER constant (1) for "s" of type set<boolean>
update lwt set s = {true} + s where a = 1 if s = {false};
   status: ERROR
     code: Invalid (0x2200)
  message: Invalid operation (s = {true} + s) for non list column 73
-- sets
-- null value == empty set
update lwt set s = {} where a = 1 if s = {};
  +-----------+--------------+
  | [APPLIED] |      S       |
  +-----------+--------------+
  | false     | [false true] |
  +-----------+--------------+
update lwt set s = {} where a = 1 if s = null;
  +-----------+--------------+
  | [APPLIED] |      S       |
  +-----------+--------------+
  | false     | [false true] |
  +-----------+--------------+
update lwt set s = {false} where a = 1 if s = null;
  +-----------+--------------+
  | [APPLIED] |      S       |
  +-----------+--------------+
  | false     | [false true] |
  +-----------+--------------+
update lwt set s = {true, false} where a = 1 if s = {false};
  +-----------+--------------+
  | [APPLIED] |      S       |
  +-----------+--------------+
  | false     | [false true] |
  +-----------+--------------+
update lwt set s = {false} where a = 1 if s = {null};
   status: ERROR
     code: Invalid (0x2200)
  message: null is not supported inside collections
update lwt set s = {false} where a = 1 if s = {null, true};
   status: ERROR
     code: Invalid (0x2200)
  message: null is not supported inside collections
update lwt set s = {true, false} where a = 1 if s{true} = false;
   status: ERROR
     code: Syntax error (0x2000)
  message: line 1:49 no viable alternative at input '{'
update lwt set s = {false} where a = 1 if s = 1;
   status: ERROR
     code: Invalid (0x2200)
  message: Invalid INTEGER constant (1) for "s" of type set<boolean>
update lwt set s = {true} + s where a = 1 if s = {false};
   status: ERROR
     code: Invalid (0x2200)
  message: Invalid operation (s = {true} + s) for non list column 73
drop table lwt;
  OK
--
-- frozen collections
--
create table lwt (a int, b frozen<map<boolean, boolean>>, c frozen<list<boolean>>, s frozen<set<boolean>>, primary key (a));
  OK
insert into lwt (a, b) values (1, {true: true});
  OK
update lwt set b = {true:false} where a = 1 if b[true] = true;
  +-----------+----------------+
  | [APPLIED] |       B        |
  +-----------+----------------+
  | true      | map[true:true] |
  +-----------+----------------+
update lwt set b = {true:false} where a = 1 if b[true] = null;
  +-----------+-----------------+
  | [APPLIED] |        B        |
  +-----------+-----------------+
  | false     | map[true:false] |
  +-----------+-----------------+
update lwt set b = {false:true} where a = 1 if b[false] = null;
  +-----------+-----------------+
  | [APPLIED] |        B        |
  +-----------+-----------------+
  | true      | map[true:false] |
  +-----------+-----------------+
update lwt set b = {false:false} where a = 1 if b[true] != null;
  +-----------+-----------------+
  | [APPLIED] |        B        |
  +-----------+-----------------+
  | false     | map[false:true] |
  +-----------+-----------------+
update lwt set b[true] = false where a = 1 if b[true] != true;
   status: ERROR
     code: Invalid (0x2200)
  message: Invalid operation (b[true] = false) for frozen collection column 62
update lwt set b = b + {false:true} where a = 1 if b[true] = true;
   status: ERROR
     code: Invalid (0x2200)
  message: Invalid operation (b = b + {false:true}) for frozen collection column 62
select b from lwt where a = 1;
  +-----------------+
  |        B        |
  +-----------------+
  | map[false:true] |
  +-----------------+
update lwt set b = {false:true} where a = 1 if b = {true:false};
  +-----------+-----------------+
  | [APPLIED] |        B        |
  +-----------+-----------------+
  | false     | map[false:true] |
  +-----------+-----------------+
update lwt set b = {} where a = 1 if exists;
  +-----------+---+-----------------+----+----+
  | [APPLIED] | A |        B        | C  | S  |
  +-----------+---+-----------------+----+----+
  | true      | 1 | map[false:true] | [] | [] |
  +-----------+---+-----------------+----+----+
update lwt set b = {} where a = 1 if b = {};
  +-----------+-------+
  | [APPLIED] |   B   |
  +-----------+-------+
  | true      | map[] |
  +-----------+-------+
select b from lwt where a = 1;
  +-------+
  |   B   |
  +-------+
  | map[] |
  +-------+
update lwt set b = {} where a = 1 if b = null;
  +-----------+-------+
  | [APPLIED] |   B   |
  +-----------+-------+
  | false     | map[] |
  +-----------+-------+
select b from lwt where a = 1;
  +-------+
  |   B   |
  +-------+
  | map[] |
  +-------+
update lwt set b = null where a = 1 if b = {};
  +-----------+-------+
  | [APPLIED] |   B   |
  +-----------+-------+
  | true      | map[] |
  +-----------+-------+
select b from lwt where a = 1;
  +-------+
  |   B   |
  +-------+
  | map[] |
  +-------+
-- lists
-- null value != empty list for a frozen list
update lwt set c = [false] where a = 1 if c = [];
  +-----------+----+
  | [APPLIED] | C  |
  +-----------+----+
  | false     | [] |
  +-----------+----+
-- c is null, really, so this should work
update lwt set c = [] where a = 1 if c = null;
  +-----------+----+
  | [APPLIED] | C  |
  +-----------+----+
  | true      | [] |
  +-----------+----+
-- check with empty list
update lwt set c = [false] where a = 1 if c = [];
  +-----------+----+
  | [APPLIED] | C  |
  +-----------+----+
  | true      | [] |
  +-----------+----+
update lwt set c = [false] where a = 1 if c = [false];
  +-----------+---------+
  | [APPLIED] |    C    |
  +-----------+---------+
  | true      | [false] |
  +-----------+---------+
update lwt set c = [false] where a = 1 if c = [null];
   status: ERROR
     code: Invalid (0x2200)
  message: null is not supported inside collections
update lwt set c = [false] where a = 1 if c = [null, true];
   status: ERROR
     code: Invalid (0x2200)
  message: null is not supported inside collections
select c from lwt where a = 1;
  +---------+
  |    C    |
  +---------+
  | [false] |
  +---------+
-- negative list index
update lwt set c = [true, false] where a = 1 if c[-1] = false;
   status: ERROR
     code: Invalid (0x2200)
  message: Invalid negative list index -1
update lwt set c = [true, false] where a = 1 if c[-1.5] = false;
   status: ERROR
     code: Invalid (0x2200)
  message: Invalid FLOAT constant (-1.5) for "idx(c)" of type int
update lwt set c = [true, false] where a = 1 if c[0] = false;
  +-----------+---------+
  | [APPLIED] |    C    |
  +-----------+---------+
  | true      | [false] |
  +-----------+---------+
update lwt set c = [true] where a = 1 if c[1] = false;
  +-----------+--------------+
  | [APPLIED] |      C       |
  +-----------+--------------+
  | true      | [true false] |
  +-----------+--------------+
update lwt set c = [true, false] where a = 1 if c[2] = null;
  +-----------+--------+
  | [APPLIED] |   C    |
  +-----------+--------+
  | true      | [true] |
  +-----------+--------+
update lwt set c = [true] where a = 1 if c[100000000] = null;
  +-----------+--------------+
  | [APPLIED] |      C       |
  +-----------+--------------+
  | true      | [true false] |
  +-----------+--------------+
update lwt set c = [false] where a = 1 if c[null] = null;
   status: ERROR
     code: Invalid (0x2200)
  message: Invalid null value for frozen<list<boolean>> element access
update lwt set c = [true] + c where a = 1 if c = [false];
   status: ERROR
     code: Invalid (0x2200)
  message: Invalid operation (c = [true] + c) for frozen list column 63
update lwt set c = [true,true,true,false,false,false] where a = 1 if exists;
  +-----------+---+-------+--------+----+
  | [APPLIED] | A |   B   |   C    | S  |
  +-----------+---+-------+--------+----+
  | true      | 1 | map[] | [true] | [] |
  +-----------+---+-------+--------+----+
update lwt set c = null where a = 1 if c[1] = true and c[5] = false and c[7] = null;
  +-----------+--------------------------------+
  | [APPLIED] |               C                |
  +-----------+--------------------------------+
  | true      | [true true true false false    |
  |           | false]                         |
  +-----------+--------------------------------+
select c from lwt where a = 1;
  +----+
  | C  |
  +----+
  | [] |
  +----+
-- sets
-- null value == empty set
update lwt set s = {} where a = 1 if s = {};
  +-----------+----+
  | [APPLIED] | S  |
  +-----------+----+
  | false     | [] |
  +-----------+----+
update lwt set s = {} where a = 1 if s = null;
  +-----------+----+
  | [APPLIED] | S  |
  +-----------+----+
  | true      | [] |
  +-----------+----+
update lwt set s = {false} where a = 1 if s = null;
  +-----------+----+
  | [APPLIED] | S  |
  +-----------+----+
  | false     | [] |
  +-----------+----+
update lwt set s = {true, false} where a = 1 if s = {false};
  +-----------+----+
  | [APPLIED] | S  |
  +-----------+----+
  | false     | [] |
  +-----------+----+
update lwt set s = {false} where a = 1 if s = {null};
   status: ERROR
     code: Invalid (0x2200)
  message: null is not supported inside collections
update lwt set s = {false} where a = 1 if s = {null, true};
   status: ERROR
     code: Invalid (0x2200)
  message: null is not supported inside collections
update lwt set s = {true, false} where a = 1 if s{true} = false;
   status: ERROR
     code: Syntax error (0x2000)
  message: line 1:49 no viable alternative at input '{'
update lwt set s = s + {true} where a = 1 if s = {true, false};
   status: ERROR
     code: Invalid (0x2200)
  message: Invalid operation (s = s + {true}) for frozen collection column 73
update lwt set s = {true, true} where a = 1 if exists;
  +-----------+---+-------+----+----+
  | [APPLIED] | A |   B   | C  | S  |
  +-----------+---+-------+----+----+
  | true      | 1 | map[] | [] | [] |
  +-----------+---+-------+----+----+
-- check non frozen sets are compared correctly to set literals
update lwt set s = {false, false} where a = 1 if  s = {true, true};
  +-----------+--------+
  | [APPLIED] |   S    |
  +-----------+--------+
  | true      | [true] |
  +-----------+--------+
update lwt set s = {false, true} where a = 1 if  s = {true, false};
  +-----------+---------+
  | [APPLIED] |    S    |
  +-----------+---------+
  | false     | [false] |
  +-----------+---------+
select s from lwt where a = 1;
  +---------+
  |    S    |
  +---------+
  | [false] |
  +---------+
drop table lwt;
  OK
-- gt/le on composite collections
create table lwt (a int, b map<int, int>, c list<int>, s set<int>, primary key (a));
  OK
insert into lwt (a, b, c, s) values (1, {}, [], {});
  OK
-- maps
update lwt set b = {1:1} where a = 1 if b > {};
   status: ERROR
     code: Invalid (0x2200)
  message: Invalid comparison with null for operator ">"
update lwt set b = {1:1} where a = 1 if b < {};
   status: ERROR
     code: Invalid (0x2200)
  message: Invalid comparison with null for operator "<"
update lwt set b = {1:1} where a = 1 if b = {};
  +-----------+-------+
  | [APPLIED] |   B   |
  +-----------+-------+
  | true      | map[] |
  +-----------+-------+
update lwt set b = {2:2} where a = 1 if b > {1:1};
  +-----------+----------+
  | [APPLIED] |    B     |
  +-----------+----------+
  | false     | map[1:1] |
  +-----------+----------+
update lwt set b = {2:2} where a = 1 if b >= {1:1};
  +-----------+----------+
  | [APPLIED] |    B     |
  +-----------+----------+
  | true      | map[1:1] |
  +-----------+----------+
update lwt set b = {3:3} where a = 1 if b > {1:1};
  +-----------+----------+
  | [APPLIED] |    B     |
  +-----------+----------+
  | true      | map[2:2] |
  +-----------+----------+
update lwt set b = {4:4} where a = 1 if b >= {2:3};
  +-----------+----------+
  | [APPLIED] |    B     |
  +-----------+----------+
  | true      | map[3:3] |
  +-----------+----------+
update lwt set b = {4:4} where a = 1 if b >= {3:3};
  +-----------+----------+
  | [APPLIED] |    B     |
  +-----------+----------+
  | true      | map[4:4] |
  +-----------+----------+
update lwt set b = {1:1} where a = 1 if b < {4:4};
  +-----------+----------+
  | [APPLIED] |    B     |
  +-----------+----------+
  | false     | map[4:4] |
  +-----------+----------+
update lwt set b = {1:1} where a = 1 if b <= {4:4};
  +-----------+----------+
  | [APPLIED] |    B     |
  +-----------+----------+
  | true      | map[4:4] |
  +-----------+----------+
select b from lwt where a= 1;
  +----------+
  |    B     |
  +----------+
  | map[1:1] |
  +----------+
-- lists
update lwt set c = [1,1] where a = 1 if c > [];
   status: ERROR
     code: Invalid (0x2200)
  message: Invalid comparison with null for operator ">"
update lwt set c = [1,1] where a = 1 if c < [];
   status: ERROR
     code: Invalid (0x2200)
  message: Invalid comparison with null for operator "<"
update lwt set c = [1,1] where a = 1 if c = [];
  +-----------+----+
  | [APPLIED] | C  |
  +-----------+----+
  | true      | [] |
  +-----------+----+
update lwt set c = [2,2] where a = 1 if c > [1,1];
  +-----------+-------+
  | [APPLIED] |   C   |
  +-----------+-------+
  | false     | [1 1] |
  +-----------+-------+
update lwt set c = [2,2] where a = 1 if c >= [1,1];
  +-----------+-------+
  | [APPLIED] |   C   |
  +-----------+-------+
  | true      | [1 1] |
  +-----------+-------+
update lwt set c = [3,3] where a = 1 if c > [1,1];
  +-----------+-------+
  | [APPLIED] |   C   |
  +-----------+-------+
  | true      | [2 2] |
  +-----------+-------+
update lwt set c = [4,4] where a = 1 if c >= [2,3];
  +-----------+-------+
  | [APPLIED] |   C   |
  +-----------+-------+
  | true      | [3 3] |
  +-----------+-------+
update lwt set c = [4,4] where a = 1 if c >= [3,3];
  +-----------+-------+
  | [APPLIED] |   C   |
  +-----------+-------+
  | true      | [4 4] |
  +-----------+-------+
update lwt set c = [1,1] where a = 1 if c < [4,4];
  +-----------+-------+
  | [APPLIED] |   C   |
  +-----------+-------+
  | false     | [4 4] |
  +-----------+-------+
update lwt set c = [1,1] where a = 1 if c <= [4,4];
  +-----------+-------+
  | [APPLIED] |   C   |
  +-----------+-------+
  | true      | [4 4] |
  +-----------+-------+
select c from lwt where a= 1;
  +-------+
  |   C   |
  +-------+
  | [1 1] |
  +-------+
-- sets
update lwt set s = {1} where a = 1 if s > {};
   status: ERROR
     code: Invalid (0x2200)
  message: Invalid comparison with null for operator ">"
update lwt set s = {1} where a = 1 if s < {};
   status: ERROR
     code: Invalid (0x2200)
  message: Invalid comparison with null for operator "<"
update lwt set s = {1} where a = 1 if s = {};
  +-----------+----+
  | [APPLIED] | S  |
  +-----------+----+
  | true      | [] |
  +-----------+----+
update lwt set s = {2} where a = 1 if s > {1};
  +-----------+-----+
  | [APPLIED] |  S  |
  +-----------+-----+
  | false     | [1] |
  +-----------+-----+
update lwt set s = {2} where a = 1 if s >= {1};
  +-----------+-----+
  | [APPLIED] |  S  |
  +-----------+-----+
  | true      | [1] |
  +-----------+-----+
update lwt set s = {3} where a = 1 if s > {1};
  +-----------+-----+
  | [APPLIED] |  S  |
  +-----------+-----+
  | true      | [2] |
  +-----------+-----+
update lwt set s = {4} where a = 1 if s >= {3};
  +-----------+-----+
  | [APPLIED] |  S  |
  +-----------+-----+
  | true      | [3] |
  +-----------+-----+
update lwt set s = {1} where a = 1 if s < {4};
  +-----------+-----+
  | [APPLIED] |  S  |
  +-----------+-----+
  | false     | [4] |
  +-----------+-----+
update lwt set s = {1} where a = 1 if s <= {4};
  +-----------+-----+
  | [APPLIED] |  S  |
  +-----------+-----+
  | true      | [4] |
  +-----------+-----+
select s from lwt where a= 1;
  +-----+
  |  S  |
  +-----+
  | [1] |
  +-----+
drop table lwt;
  OK
-- collections of collections
-- non-frozen nested sets are not supported
create table lwt (a int, b set<map<int,int>>, c list<set<int>>, primary key (a));
   status: ERROR
     code: Invalid (0x2200)
  message: Non-frozen user types or collections are not allowed inside collections: list<se
-- frozen collection elements are however ok
create table lwt (a int, b set<frozen<list<int>>>, c list<frozen<set<int>>>, primary key (a));
  OK
insert into lwt (a, b, c) values (1, {[1,2], [1,2]}, [{1,2}, {1,2}]);
  OK
-- sets
update lwt set b={[3,3], [4,4]} where a = 1 if b = {[1,2], [1,2]};
  +-----------+---------+
  | [APPLIED] |    B    |
  +-----------+---------+
  | true      | [[1 2]] |
  +-----------+---------+
update lwt set b={[5,5,5], [4,4,4]} where a = 1 if b > {[3,3], [4,4]};
  +-----------+---------------+
  | [APPLIED] |       B       |
  +-----------+---------------+
  | false     | [[3 3] [4 4]] |
  +-----------+---------------+
update lwt set b={[5,5,5], [4,4,4]} where a = 1 if b >= {[3,3], [4,4]};
  +-----------+---------------+
  | [APPLIED] |       B       |
  +-----------+---------------+
  | true      | [[3 3] [4 4]] |
  +-----------+---------------+
select b from lwt where a = 1;
  +-------------------+
  |         B         |
  +-------------------+
  | [[4 4 4] [5 5 5]] |
  +-------------------+
-- lists
update lwt set c=[{3,4}, {4,5}] where a = 1 if c = [{1,2}, {1,2}];
  +-----------+---------------+
  | [APPLIED] |       C       |
  +-----------+---------------+
  | true      | [[1 2] [1 2]] |
  +-----------+---------------+
update lwt set c=[{3,4,5}, {4,5,6}] where a = 1 if c > [{3,3}, {4,4}];
  +-----------+---------------+
  | [APPLIED] |       C       |
  +-----------+---------------+
  | true      | [[3 4] [4 5]] |
  +-----------+---------------+
update lwt set c=[{5,6,7}, {7,8,9}] where a = 1 if c >= [{3,3}, {5,4}];
  +-----------+-------------------+
  | [APPLIED] |         C         |
  +-----------+-------------------+
  | true      | [[3 4 5] [4 5 6]] |
  +-----------+-------------------+
update lwt set c=[{5,6,7}, {7,8,9}] where a = 1 if c >= [{3,4}, {4,5}];
  +-----------+-------------------+
  | [APPLIED] |         C         |
  +-----------+-------------------+
  | true      | [[5 6 7] [7 8 9]] |
  +-----------+-------------------+
select c from lwt where a = 1;
  +-------------------+
  |         C         |
  +-------------------+
  | [[5 6 7] [7 8 9]] |
  +-------------------+
drop table lwt;
  OK
-- in predicate, static columns
create table lwt (a int, b int, c list<int>, d set<int> static, primary key (a, b));
  OK
insert into lwt (a, b, c, d) values (1,1,[1],{1});
  OK
update lwt set d = {2,3,4,5,-1} where a = 1 if d in ({1});
  +-----------+-----+
  | [APPLIED] |  D  |
  +-----------+-----+
  | true      | [1] |
  +-----------+-----+
update lwt set d = {2} where a = 1 if d in ({2,3,4,5});
  +-----------+--------------+
  | [APPLIED] |      D       |
  +-----------+--------------+
  | false     | [-1 2 3 4 5] |
  +-----------+--------------+
update lwt set d = {2} where a = 1 if d in ({2,3,4,5,-1});
  +-----------+--------------+
  | [APPLIED] |      D       |
  +-----------+--------------+
  | true      | [-1 2 3 4 5] |
  +-----------+--------------+
update lwt set c = [2,3,4,5,-1] where a = 1 and b = 1 if c in ([1]);
  +-----------+-----+
  | [APPLIED] |  C  |
  +-----------+-----+
  | true      | [1] |
  +-----------+-----+
update lwt set c = [2] where a = 1 and b = 1 if c in ([2,3,4,5]);
  +-----------+--------------+
  | [APPLIED] |      C       |
  +-----------+--------------+
  | false     | [2 3 4 5 -1] |
  +-----------+--------------+
-- check null handling in IN condition
update lwt set c = [] where a = 1 and b = 1 if c in ([2,3,4,5,-1]);
  +-----------+--------------+
  | [APPLIED] |      C       |
  +-----------+--------------+
  | true      | [2 3 4 5 -1] |
  +-----------+--------------+
update lwt set c = null where a = 1 and b = 1 if c in ([]);
  +-----------+----+
  | [APPLIED] | C  |
  +-----------+----+
  | true      | [] |
  +-----------+----+
update lwt set c = null where a = 1 and b = 1 if c in ([]);
  +-----------+----+
  | [APPLIED] | C  |
  +-----------+----+
  | true      | [] |
  +-----------+----+
update lwt set c = null where a = 1 and b = 1 if c in (null);
  +-----------+----+
  | [APPLIED] | C  |
  +-----------+----+
  | true      | [] |
  +-----------+----+
update lwt set c = [1] where a = 1 and b = 1 if c in ();
  +-----------+----+
  | [APPLIED] | C  |
  +-----------+----+
  | false     | [] |
  +-----------+----+
update lwt set c = [2] where a = 1 and b = 1 if c in ([1], null, [2]);
  +-----------+----+
  | [APPLIED] | C  |
  +-----------+----+
  | true      | [] |
  +-----------+----+
delete from lwt where a = 1;
  OK
update lwt set d = {2} where a = 1 if d in ();
  +-----------+----+
  | [APPLIED] | D  |
  +-----------+----+
  | false     | [] |
  +-----------+----+
update lwt set d = {2} where a = 1 if d in (null);
  +-----------+----+
  | [APPLIED] | D  |
  +-----------+----+
  | true      | [] |
  +-----------+----+
update lwt set d = {} where a = 1 if d in ({}, {2});
  +-----------+-----+
  | [APPLIED] |  D  |
  +-----------+-----+
  | true      | [2] |
  +-----------+-----+
update lwt set d = {} where a = 1 if d in (null, {2});
  +-----------+----+
  | [APPLIED] | D  |
  +-----------+----+
  | true      | [] |
  +-----------+----+
update lwt set d = null where a = 1 if d in (null, {2});
  +-----------+----+
  | [APPLIED] | D  |
  +-----------+----+
  | true      | [] |
  +-----------+----+
update lwt set d = null where a = 1 if d in (null, {2}, {3,4}, {5});
  +-----------+----+
  | [APPLIED] | D  |
  +-----------+----+
  | true      | [] |
  +-----------+----+
drop table lwt;
  OK

-- in predicate, frozen sets/lists columns
create table lwt (a int, b int, c frozen<list<int>>, d frozen<set<int>> static, primary key (a, b));
  OK
insert into lwt (a, b, c, d) values (1,1,[1],{1});
  OK
update lwt set d = {2,3,4,5,-1} where a = 1 if d in ({1});
  +-----------+-----+
  | [APPLIED] |  D  |
  +-----------+-----+
  | true      | [1] |
  +-----------+-----+
update lwt set d = {2} where a = 1 if d in ({2,3,4,5});
  +-----------+--------------+
  | [APPLIED] |      D       |
  +-----------+--------------+
  | false     | [-1 2 3 4 5] |
  +-----------+--------------+
update lwt set d = {2} where a = 1 if d in ({2,3,4,5,-1});
  +-----------+--------------+
  | [APPLIED] |      D       |
  +-----------+--------------+
  | true      | [-1 2 3 4 5] |
  +-----------+--------------+
update lwt set c = [2,3,4,5,-1] where a = 1 and b = 1 if c in ([1]);
  +-----------+-----+
  | [APPLIED] |  C  |
  +-----------+-----+
  | true      | [1] |
  +-----------+-----+
update lwt set c = [2] where a = 1 and b = 1 if c in ([2,3,4,5]);
  +-----------+--------------+
  | [APPLIED] |      C       |
  +-----------+--------------+
  | false     | [2 3 4 5 -1] |
  +-----------+--------------+
-- check null handling in IN condition
update lwt set c = [] where a = 1 and b = 1 if c in ([2,3,4,5,-1]);
  +-----------+--------------+
  | [APPLIED] |      C       |
  +-----------+--------------+
  | true      | [2 3 4 5 -1] |
  +-----------+--------------+
update lwt set c = null where a = 1 and b = 1 if c in ([]);
  +-----------+----+
  | [APPLIED] | C  |
  +-----------+----+
  | true      | [] |
  +-----------+----+
update lwt set c = null where a = 1 and b = 1 if c in ([]);
  +-----------+----+
  | [APPLIED] | C  |
  +-----------+----+
  | false     | [] |
  +-----------+----+
update lwt set c = null where a = 1 and b = 1 if c in (null);
  +-----------+----+
  | [APPLIED] | C  |
  +-----------+----+
  | true      | [] |
  +-----------+----+
update lwt set c = [1] where a = 1 and b = 1 if c in ();
  +-----------+----+
  | [APPLIED] | C  |
  +-----------+----+
  | false     | [] |
  +-----------+----+
update lwt set c = [2] where a = 1 and b = 1 if c in ([1], null, [2]);
  +-----------+----+
  | [APPLIED] | C  |
  +-----------+----+
  | true      | [] |
  +-----------+----+
delete from lwt where a = 1;
  OK
update lwt set d = {2} where a = 1 if d in ();
  +-----------+----+
  | [APPLIED] | D  |
  +-----------+----+
  | false     | [] |
  +-----------+----+
update lwt set d = {2} where a = 1 if d in (null);
  +-----------+----+
  | [APPLIED] | D  |
  +-----------+----+
  | true      | [] |
  +-----------+----+
update lwt set d = {} where a = 1 if d in ({}, {2});
  +-----------+-----+
  | [APPLIED] |  D  |
  +-----------+-----+
  | true      | [2] |
  +-----------+-----+
update lwt set d = {} where a = 1 if d in (null, {2});
  +-----------+----+
  | [APPLIED] | D  |
  +-----------+----+
  | false     | [] |
  +-----------+----+
update lwt set d = null where a = 1 if d in (null, {2});
  +-----------+----+
  | [APPLIED] | D  |
  +-----------+----+
  | false     | [] |
  +-----------+----+
update lwt set d = null where a = 1 if d in (null, {2}, {3,4}, {5});
  +-----------+----+
  | [APPLIED] | D  |
  +-----------+----+
  | false     | [] |
  +-----------+----+
drop table lwt;
  OK
-- LWT and slices; a slice is a Cassandra term for a clustering key range,
-- usually within the same partition key
create table lwt (a int, b int, c int, d int, primary key (a, b, c));
  OK
insert into lwt (a, b, c, d) values (1,1,1,1);
  OK
insert into lwt (a, b, c, d) values (1,1,2,0);
  OK
insert into lwt (a, b, c, d) values (1,1,3,1);
  OK
insert into lwt (a, b, c, d) values (1,2,1,1);
  OK
insert into lwt (a, b, c, d) values (1,2,2,0);
  OK
insert into lwt (a, b, c, d) values (1,2,3,1);
  OK
insert into lwt (a, b, c, d) values (1,3,1,1);
  OK
insert into lwt (a, b, c, d) values (1,3,2,0);
  OK
insert into lwt (a, b, c, d) values (1,3,3,1);
  OK
-- update
select d from lwt    where a = 1 and b = 1;
  +---+
  | D |
  +---+
  | 1 |
  | 0 |
  | 1 |
  +---+
update lwt set d = 7 where a = 1 and b = 1 if d = 0;
   status: ERROR
     code: Invalid (0x2200)
  message: Missing mandatory PRIMARY KEY part c
select d from lwt    where a = 1 and b = 1;
  +---+
  | D |
  +---+
  | 1 |
  | 0 |
  | 1 |
  +---+
select d from lwt    where a = 1 and b = 2;
  +---+
  | D |
  +---+
  | 1 |
  | 0 |
  | 1 |
  +---+
update lwt set d = 7 where a = 1 and b = 2;
   status: ERROR
     code: Invalid (0x2200)
  message: Missing mandatory PRIMARY KEY part c
-- delete
select a, b, c, d from lwt where a = 1 and b = 1;
  +---+---+---+---+
  | A | B | C | D |
  +---+---+---+---+
  | 1 | 1 | 1 | 1 |
  | 1 | 1 | 2 | 0 |
  | 1 | 1 | 3 | 1 |
  +---+---+---+---+
delete from lwt            where a = 1 and b = 1 if d = 0;
   status: ERROR
     code: Invalid (0x2200)
  message: DELETE statements must restrict all PRIMARY KEY columns with equality relations 
select a, b, c, d from lwt where a = 1 and b = 1;
  +---+---+---+---+
  | A | B | C | D |
  +---+---+---+---+
  | 1 | 1 | 1 | 1 |
  | 1 | 1 | 2 | 0 |
  | 1 | 1 | 3 | 1 |
  +---+---+---+---+
select a, b, c, d from lwt where a = 1 and b = 2;
  +---+---+---+---+
  | A | B | C | D |
  +---+---+---+---+
  | 1 | 2 | 1 | 1 |
  | 1 | 2 | 2 | 0 |
  | 1 | 2 | 3 | 1 |
  +---+---+---+---+
delete from lwt            where a = 1 and b = 2 if d = 1;
   status: ERROR
     code: Invalid (0x2200)
  message: DELETE statements must restrict all PRIMARY KEY columns with equality relations 
select a, b, c, d from lwt where a = 1 and b = 2;
  +---+---+---+---+
  | A | B | C | D |
  +---+---+---+---+
  | 1 | 2 | 1 | 1 |
  | 1 | 2 | 2 | 0 |
  | 1 | 2 | 3 | 1 |
  +---+---+---+---+
select a, b, c, d from lwt where a = 1 and b = 3;
  +---+---+---+---+
  | A | B | C | D |
  +---+---+---+---+
  | 1 | 3 | 1 | 1 |
  | 1 | 3 | 2 | 0 |
  | 1 | 3 | 3 | 1 |
  +---+---+---+---+
delete from lwt            where a = 1 and b = 3;
  OK
select a, b, c, d from lwt where a = 1 and b = 3;
  OK
drop table lwt;
  OK
-- ok to delete if d is static
create table lwt (a int, b int, c int, d int static, primary key (a, b, c));
  OK
insert into lwt (a, b, c, d) values (1,1,1,1);
  OK
insert into lwt (a, b, c, d) values (1,1,2,1);
  OK
insert into lwt (a, b, c, d) values (1,1,3,1);
  OK
select a, b, c, d from lwt where a = 1 and b = 1;
  +---+---+---+---+
  | A | B | C | D |
  +---+---+---+---+
  | 1 | 1 | 1 | 1 |
  | 1 | 1 | 2 | 1 |
  | 1 | 1 | 3 | 1 |
  +---+---+---+---+
-- try to delete all - fail
delete from lwt            where a = 1 and b = 1 if d = 0;
   status: ERROR
     code: Invalid (0x2200)
  message: DELETE statements must restrict all PRIMARY KEY columns with equality relations 
-- ok to delete static row
delete d from lwt          where a = 1 if d = 0;
  +-----------+---+
  | [APPLIED] | D |
  +-----------+---+
  | false     | 1 |
  +-----------+---+
select a, b, c, d from lwt where a = 1;
  +---+---+---+---+
  | A | B | C | D |
  +---+---+---+---+
  | 1 | 1 | 1 | 1 |
  | 1 | 1 | 2 | 1 |
  | 1 | 1 | 3 | 1 |
  +---+---+---+---+
delete d from lwt          where a = 1 if d = 1;
  +-----------+---+
  | [APPLIED] | D |
  +-----------+---+
  | true      | 1 |
  +-----------+---+
select a, b, c, d from lwt where a = 1;
  +---+---+---+---+
  | A | B | C | D |
  +---+---+---+---+
  | 1 | 1 | 1 | 0 |
  | 1 | 1 | 2 | 0 |
  | 1 | 1 | 3 | 0 |
  +---+---+---+---+
drop table lwt;
  OK
--
-- lists, sets, maps as partition or primary keys
--
-- This is covered with tests since with collections_as_maps
-- flags, sets/ints in primary key will make it difficult
-- to find the matching cells
--
-- invalid collection type
create table lwt (a int, b int, c set<int>, primary key (a, b, c));
   status: ERROR
     code: Invalid (0x2200)
  message: Invalid non-frozen collection type for PRIMARY KEY component c
-- ok - frozen collections are allowed
create table lwt (a int, b int, c frozen<list<int>>, primary key (a, b, c));
  OK
drop table lwt;
  OK
-- invalid collection type
create table lwt (a list<int>, b int, c int, primary key (a, b, c));
   status: ERROR
     code: Invalid (0x2200)
  message: Invalid non-frozen collection type for PRIMARY KEY component a
--
-- test empty primary key range: it is impossible to construct due to
-- limitations of the query language
--
create table lwt (a int, b int, c int, primary key (a, b));
  OK
-- error: can't use token and non-token restrictions
update lwt set c = 1 where a = 1 and b = 1 and token(a) > 0 and token(a) < 0 if c = 1;
   status: ERROR
     code: Invalid (0x2200)
  message: Columns "ColumnDefinition{name=a, type=org.apache.cassandra.db.marshal.Int32Type
-- error: can't use eq and non-eq restriction 
update lwt set c = 1 where a = 1 and b = 1 and a < 0 if c = 1;
   status: ERROR
     code: Invalid (0x2200)
  message: Only EQ and IN relation are supported on the partition key (unless you use the t
update lwt set c = 1 where a = 1 and b = 1 and a < 0 if c = 1;
   status: ERROR
     code: Invalid (0x2200)
  message: Only EQ and IN relation are supported on the partition key (unless you use the t
-- error: partition key must be fully restricted
update lwt set c = 1 where a > 0 and a < 0 and b = 1 if c = 1;
   status: ERROR
     code: Invalid (0x2200)
  message: Only EQ and IN relation are supported on the partition key (unless you use the t
-- error: partition key and IN is not supported 
update lwt set c = 1 where a in () and b = 1 if c = 1;
   status: ERROR
     code: Invalid (0x2200)
  message: IN on the partition key is not supported with conditional updates
drop table lwt;
  OK
